protein	Index	logFC	se	df	t	pval	adjPval	group1	group2	batch	gene	Synonyms	GO cellular component	GO biological process	GO molecular function	Description	Interpro terms	bait	control
P43286	P43286_S280	4.268711490228986	0.5732043213034493	11.300850400890797	7.447102772222765	1.0985924762238876e-5	5.76761050017541e-5	At_XVE_GFP_suc_4h	At_XVE_GFP_suc_24h	R1067	AT3G53420	AtPIP2;1;<br>PIP2;<br>PIP2;1;<br>PLASMA MEMBRANE INTRINSIC PROTEIN 2;<br>PLASMA MEMBRANE INTRINSIC PROTEIN 2;1;<br>plasma membrane intrinsic protein 2A	membrane; plant-type vacuole; plasma membrane; plasmodesma	hydrogen peroxide transmembrane transport; response to water deprivation; transmembrane transport; water transport	channel activity; mRNA binding; ubiquitin protein ligase binding; water channel activity	plasma membrane intrinsic protein 2A [Source:NCBI gene (formerly Entrezgene);Acc:824510]	Major intrinsic protein; Major intrinsic protein, conserved site; Aquaporin-like; Aquaporin transporter	GFP	GFP
P43286	P43286_S283	4.191621320095245	0.554355107744196	11.084422886780189	7.561256785658489	1.063713584732509e-5	5.764641362421339e-5	At_XVE_GFP_suc_4h	At_XVE_GFP_suc_24h	R1067	AT3G53420	AtPIP2;1;<br>PIP2;<br>PIP2;1;<br>PLASMA MEMBRANE INTRINSIC PROTEIN 2;<br>PLASMA MEMBRANE INTRINSIC PROTEIN 2;1;<br>plasma membrane intrinsic protein 2A	membrane; plant-type vacuole; plasma membrane; plasmodesma	hydrogen peroxide transmembrane transport; response to water deprivation; transmembrane transport; water transport	channel activity; mRNA binding; ubiquitin protein ligase binding; water channel activity	plasma membrane intrinsic protein 2A [Source:NCBI gene (formerly Entrezgene);Acc:824510]	Major intrinsic protein; Major intrinsic protein, conserved site; Aquaporin-like; Aquaporin transporter	GFP	GFP
PafA	PafA_T285	2.2924373554567685	0.3668176567947437	9.009226293851688	6.249528377363589	1.490660400553574e-4	6.768403980891903e-4	At_XVE_GFP_suc_4h	At_XVE_GFP_suc_24h	R1067	NA	NA	NA	NA	NA	NA	NA	GFP	GFP
PafA	PafA_T286	2.2924233096240614	0.394071475070312	9.04535817451001	5.817277967696182	2.4906902868942804e-4	0.00107291273896984	At_XVE_GFP_suc_4h	At_XVE_GFP_suc_24h	R1067	NA	NA	NA	NA	NA	NA	NA	GFP	GFP
Q8H1Y0	Q8H1Y0_S296	2.3834075099027556	0.2297969468530236	12.09932706502514	10.371797983143637	2.241225660812445e-7	1.981715321139425e-6	At_XVE_GFP_suc_4h	At_XVE_GFP_suc_24h	R1067	AT1G24180	F3I6.11;<br>F3I6_11;<br>IAA-CONJUGATE-RESISTANT 4	cytosol; intracellular membrane-bounded organelle; mitochondrial matrix; mitochondrion; nucleus	acetyl-CoA biosynthetic process from pyruvate; glycolytic process	cobalt ion binding; oxidoreductase activity; oxidoreductase activity, acting on the aldehyde or oxo group of donors, disulfide as acceptor; pyruvate dehydrogenase (acetyl-transferring) activity; zinc ion binding	Thiamin diphosphate-binding fold (THDP-binding) superfamily protein [Source:NCBI gene (formerly Entrezgene);Acc:839031]	Dehydrogenase, E1 component; Pyruvate dehydrogenase (acetyl-transferring) E1 component, alpha subunit, subgroup y; Thiamin diphosphate-binding fold	GFP	GFP
Q8LE63	Q8LE63_S234	4.1561069621241575	0.6419711924109375	10.88954855903827	6.473977354833949	4.8091536662136826e-5	2.448296411890602e-4	At_XVE_GFP_suc_4h	At_XVE_GFP_suc_24h	R1067	AT4G11860	T26M18.70<br>T26M18_70	cytosol	NA	cysteine-type deubiquitinase activity; K48-linked deubiquitinase activity	FAM63A-like protein (DUF544) [Source:NCBI gene (formerly Entrezgene);Acc:826793]	MINDY deubiquitinase; MINDY deubiquitinase domain	GFP	GFP
Q93VP3	Q93VP3_S2	1.0650167773100407	0.33064582282224536	11.456491891489696	3.221019906495513	0.00775513684283877	0.02714297894993572	At_XVE_GFP_suc_4h	At_XVE_GFP_suc_24h	R1067	AT1G26630	ATELF5A-2;<br>ELF5A-2;<br>EUKARYOTIC ELONGATION FACTOR 5A-2;<br>FUMONISIN B1-RESISTANT12;<br>T24P13.1;<br>T24P13_1	cytoplasm; cytosol; nucleus	defense response to bacterium; positive regulation of translational elongation; positive regulation of translational termination; programmed cell death; programmed cell death induced by symbiont; response to bacterium; response to wounding; translation; translational elongation; translational initiation	mRNA binding; ribosome binding; RNA binding; translation elongation factor activity; translation initiation factor activity	Eukaryotic translation initiation factor 5A-1 (eIF-5A 1) protein [Source:NCBI gene (formerly Entrezgene);Acc:839203]	Translation elongation factor IF5A-like; Translation protein SH3-like domain superfamily; Nucleic acid-binding, OB-fold; Ribosomal protein L2, domain 2; Translation elongation factor, IF5A, hypusine site; Translation elongation factor, IF5A C-terminal	GFP	GFP
Q96327	Q96327_S2	6.424368370877672	0.7113855750440341	11.265072586701164	9.03078245644777	1.7030645668749165e-6	1.1004417201345614e-5	At_XVE_GFP_suc_4h	At_XVE_GFP_suc_24h	R1067	AT3G51800	A. THALIANA ERBB-3 BINDING PROTEIN 1;<br>ATEBP1;<br>EBP1;<br>ERBB-3 BINDING PROTEIN 1	cytosol; nucleolus; nucleus; ribonucleoprotein complex	auxin-activated signaling pathway; cell cycle G1/S phase transition; regulation of cell division; regulation of cell growth; rRNA processing	mRNA binding; protein binding; RNA binding	metallopeptidase M24 family protein [Source:NCBI gene (formerly Entrezgene);Acc:824343]	Peptidase M24; Peptidase M24, methionine aminopeptidase; PA2G4 family; Creatinase/aminopeptidase-like; Winged helix-like DNA-binding domain superfamily; Winged helix DNA-binding domain superfamily; Proliferation-associated protein 2G4/ARX1	GFP	GFP
Q96327	Q96327_S3	3.113237406620863	0.20844418605483744	10.44951397083608	14.935592426654845	2.1924744387539547e-8	2.455571371404429e-7	At_XVE_GFP_suc_4h	At_XVE_GFP_suc_24h	R1067	AT3G51800	A. THALIANA ERBB-3 BINDING PROTEIN 1;<br>ATEBP1;<br>EBP1;<br>ERBB-3 BINDING PROTEIN 1	cytosol; nucleolus; nucleus; ribonucleoprotein complex	auxin-activated signaling pathway; cell cycle G1/S phase transition; regulation of cell division; regulation of cell growth; rRNA processing	mRNA binding; protein binding; RNA binding	metallopeptidase M24 family protein [Source:NCBI gene (formerly Entrezgene);Acc:824343]	Peptidase M24; Peptidase M24, methionine aminopeptidase; PA2G4 family; Creatinase/aminopeptidase-like; Winged helix-like DNA-binding domain superfamily; Winged helix DNA-binding domain superfamily; Proliferation-associated protein 2G4/ARX1	GFP	GFP
Q9C9Z6	Q9C9Z6_S218	7.832535272929189	0.22116159056851684	7.429388196811753	35.41544104830732	1.4762006698129335e-9	2.4800171252857283e-8	At_XVE_GFP_suc_4h	At_XVE_GFP_suc_24h	R1067	AT3G08600	NA	cytosol; membrane; plasma membrane	NA	molecular_function	transmembrane protein, putative (DUF1191) [Source:NCBI gene (formerly Entrezgene);Acc:820007]	Protein of unknown function DUF1191	GFP	GFP
Q9FKA5	Q9FKA5_S339	2.4230752041240455	0.31691294639474626	11.185124653936628	7.645870046299298	9.07724411336137e-6	5.083256703482367e-5	At_XVE_GFP_suc_4h	At_XVE_GFP_suc_24h	R1067	NA	NA	NA	NA	NA	NA	NA	GFP	GFP
Q9FRL0	Q9FRL0_S20	1.0628993336151369	0.28828224132531605	9.68442866039815	3.687009399984835	0.00443090508430784	0.01618243596008083	At_XVE_GFP_suc_4h	At_XVE_GFP_suc_24h	R1067	AT1G75190	F22H5.8<br>F22H5_8	NA	NA	molecular_function	NA	NA	GFP	GFP
Q9FXI5	Q9FXI5_T705	4.336072406279495	0.7318849374270672	10.134349743031082	5.924527455808704	1.3853470659279927e-4	6.464952974330633e-4	At_XVE_GFP_suc_4h	At_XVE_GFP_suc_24h	R1067	AT1G19870	F6F9.8;<br>F6F9_8;<br>IQ-domain 32;<br>IQD32	chloroplast envelope; cytoplasm; cytoskeleton; microtubule associated complex; nucleus; plasma membrane	NA	calmodulin binding; protein binding	IQ-domain 32 [Source:NCBI gene (formerly Entrezgene);Acc:838575]	IQ motif, EF-hand binding site; Domain of unknown function DUF4005	GFP	GFP
Q9LF98	Q9LF98_S350	3.821891888872865	0.4728049279618401	10.503688507071818	8.083443430567053	7.919525250730746e-6	4.587862903871605e-5	At_XVE_GFP_suc_4h	At_XVE_GFP_suc_24h	R1067	AT3G52930	AtFBA8;<br>fructose-bisphosphate aldolase 8	apoplast; chloroplast; cytoplasm; cytosol; membrane; mitochondrial envelope; mitochondrial outer membrane; mitochondrion; nucleolus; plant-type cell wall; plant-type vacuole; plasma membrane; plasmodesma	gluconeogenesis; glycolytic process	copper ion binding; fructose-bisphosphate aldolase activity; lyase activity; mRNA binding; protein binding	Aldolase superfamily protein [Source:NCBI gene (formerly Entrezgene);Acc:824459]	Fructose-bisphosphate aldolase, class-I; Aldolase-type TIM barrel; Fructose-bisphosphate aldolase class-I active site	GFP	GFP
F4I0K2	F4I0K2_S131	4.016276921257956	0.4622278383421294	9.2838550076584	8.68895507389412	9.29051869884793e-6	4.590609239430742e-5	At_XVE_LST8_suc_24h	At_XVE_GFP_suc_24h	R1067	AT1G69200	F4N2.16;<br>F4N2_16;<br>fructokinase-like 2	chloroplast; chloroplast nucleoid; plastid; plastid-encoded plastid RNA polymerase complex	chloroplast organization; etioplast organization; phosphorylation; plastid transcription; regulation of DNA-templated transcription	kinase activity; protein binding; transferase activity	fructokinase-like protein [Source:NCBI gene (formerly Entrezgene);Acc:843251]	Carbohydrate kinase PfkB; Ribokinase-like	Q9LV27	GFP
F4JTP5	F4JTP5_T443	4.701312699316023	0.37451312376047496	9.717040208385251	12.553132056122047	2.5282993419882605e-7	1.633670344053953e-6	At_XVE_LST8_suc_24h	At_XVE_GFP_suc_24h	R1067	AT4G38470	F20M13.30;<br>F20M13_30;<br>serine/threonine/tyrosine kinase 46	cytoplasm; cytosol	cellular response to hypoxia; chloroplast organization; phosphorylation; protein phosphorylation; response to abscisic acid	ATP binding; kinase activity; nucleotide binding; protein kinase activity; protein serine kinase activity; protein serine/threonine kinase activity; protein serine/threonine/tyrosine kinase activity; transferase activity	ACT-like protein tyrosine kinase family protein [Source:NCBI gene (formerly Entrezgene);Acc:830003]	Protein kinase domain; Serine-threonine/tyrosine-protein kinase, catalytic domain; ACT domain; Serine/threonine-protein kinase, active site; Protein kinase-like domain superfamily; ACT-like domain	Q9LV27	GFP
O48963	O48963_S350	5.2784795568655065	0.24312284786019075	9.643446770023004	21.711162086670388	1.641640744147816e-9	2.1215049616679476e-8	At_XVE_LST8_suc_24h	At_XVE_GFP_suc_24h	R1067	AT3G45780	F16L2.3;<br>JK224;<br>NONPHOTOTROPIC HYPOCOTYL 1;<br>NPH1;<br>PHOTOTROPIN;<br>phototropin 1;<br>ROOT PHOTOTROPISM 1;<br>RPT1	cell surface; cytoplasm; cytoplasmic side of plasma membrane; membrane; plant-type vacuole; plasma membrane	blue light signaling pathway; cellular response to blue light; chloroplast accumulation movement; chloroplast avoidance movement; circadian rhythm; negative regulation of anion channel activity by blue light; phosphorylation; phototropism; protein autophosphorylation; protein phosphorylation; regulation of proton transport; regulation of stomatal movement; response to blue light; response to stimulus	ATP binding; blue light photoreceptor activity; FMN binding; identical protein binding; kinase activity; mRNA binding; nucleotide binding; photoreceptor activity; protein binding; protein kinase activity; protein serine kinase activity; protein serine/threonine kinase activity; transferase activity	phototropin 1 [Source:NCBI gene (formerly Entrezgene);Acc:823721]	PAS domain; PAS-associated, C-terminal; Protein kinase domain; PAC motif; Serine/threonine-protein kinase, active site; Protein kinase-like domain superfamily; Protein kinase, ATP binding site; PAS domain superfamily	Q9LV27	GFP
O80837	O80837_T58	4.958554928040538	0.5648618282003018	9.119113359412736	8.778350174305315	9.599283006307172e-6	4.6076558430274425e-5	At_XVE_LST8_suc_24h	At_XVE_GFP_suc_24h	R1067	AT2G45820	F4I18.20	cytosol; plasma membrane; plasmodesma	defense response to virus; membrane raft localization; response to oxygen-containing compound; response to salicylic acid	protein binding	Remorin family protein [Source:NCBI gene (formerly Entrezgene);Acc:819190]	Remorin, C-terminal; Remorin, N-terminal	Q9LV27	GFP
P51430	P51430_S237	7.187944569665879	1.007013658769706	9.98496221921584	7.137881901669111	3.1748779942336635e-5	1.403630271134883e-4	At_XVE_LST8_suc_24h	At_XVE_GFP_suc_24h	R1067	AT5G10360	embryo defective 3010;<br>F12B17.290;<br>F12B17_290;<br>Ribosomal protein small subunit 6b;<br>RPS6B	cellular anatomical entity; cytosolic ribosome; cytosolic small ribosomal subunit; plasma membrane; plasmodesma; polysomal ribosome; ribonucleoprotein complex; ribosome	translation	mRNA binding; structural constituent of ribosome	Ribosomal protein S6e [Source:NCBI gene (formerly Entrezgene);Acc:830900]	Ribosomal protein S6e; Ribosomal protein S6, eukaryotic; Ribosomal protein S6/S6e/A/B/2, conserved site	Q9LV27	GFP
P93004	P93004_S276	5.160844960684619	0.5517255065228056	9.552170007759887	9.354008287944351	4.073935619187646e-6	2.2814039467450814e-5	At_XVE_LST8_suc_24h	At_XVE_GFP_suc_24h	R1067	AT4G35100	PIP2;7;<br>PIP3A;<br>PLASMA MEMBRANE INTRINSIC PROTEIN 2;7;<br>PLASMA MEMBRANE INTRINSIC PROTEIN 3;<br>PLASMA MEMBRANE INTRINSIC PROTEIN 3A;<br>SIMIP;<br>T12J5.9	membrane; plasma membrane; plasmodesma; vacuole	transmembrane transport; water transport	channel activity; mRNA binding; protein binding; water channel activity	plasma membrane intrinsic protein 3 [Source:NCBI gene (formerly Entrezgene);Acc:829662]	Major intrinsic protein; Major intrinsic protein, conserved site; Aquaporin-like; Aquaporin transporter	Q9LV27	GFP
Q84R17	Q84R17_S44	5.230152938755163	0.18270888742573269	10.267777330321229	28.625607721907397	3.9383597586044455e-11	9.452063420650667e-10	At_XVE_LST8_suc_24h	At_XVE_GFP_suc_24h	R1067	AT4G24275	NA	NA	response to water deprivation	NA	NA	NA	Q9LV27	GFP
Q8H1Y0	Q8H1Y0_S296	1.46014452847264	0.23795989437015996	12.09932706502514	6.136095043819877	4.8742878640473226e-5	2.099693233743462e-4	At_XVE_LST8_suc_24h	At_XVE_GFP_suc_24h	R1067	AT1G24180	F3I6.11;<br>F3I6_11;<br>IAA-CONJUGATE-RESISTANT 4	cytosol; intracellular membrane-bounded organelle; mitochondrial matrix; mitochondrion; nucleus	acetyl-CoA biosynthetic process from pyruvate; glycolytic process	cobalt ion binding; oxidoreductase activity; oxidoreductase activity, acting on the aldehyde or oxo group of donors, disulfide as acceptor; pyruvate dehydrogenase (acetyl-transferring) activity; zinc ion binding	Thiamin diphosphate-binding fold (THDP-binding) superfamily protein [Source:NCBI gene (formerly Entrezgene);Acc:839031]	Dehydrogenase, E1 component; Pyruvate dehydrogenase (acetyl-transferring) E1 component, alpha subunit, subgroup y; Thiamin diphosphate-binding fold	Q9LV27	GFP
Q8H1Y0	Q8H1Y0_Y292	4.730268114077415	0.28577806937607475	9.500982581206705	16.552243229876865	2.5232544842765157e-8	2.018603587421213e-7	At_XVE_LST8_suc_24h	At_XVE_GFP_suc_24h	R1067	AT1G24180	F3I6.11;<br>F3I6_11;<br>IAA-CONJUGATE-RESISTANT 4	cytosol; intracellular membrane-bounded organelle; mitochondrial matrix; mitochondrion; nucleus	acetyl-CoA biosynthetic process from pyruvate; glycolytic process	cobalt ion binding; oxidoreductase activity; oxidoreductase activity, acting on the aldehyde or oxo group of donors, disulfide as acceptor; pyruvate dehydrogenase (acetyl-transferring) activity; zinc ion binding	Thiamin diphosphate-binding fold (THDP-binding) superfamily protein [Source:NCBI gene (formerly Entrezgene);Acc:839031]	Dehydrogenase, E1 component; Pyruvate dehydrogenase (acetyl-transferring) E1 component, alpha subunit, subgroup y; Thiamin diphosphate-binding fold	Q9LV27	GFP
Q8L7W3	Q8L7W3_S444	5.400833324404303	0.2877646455341248	9.581146138420689	18.76823094226786	7.072852448820688e-9	6.253890586325662e-8	At_XVE_LST8_suc_24h	At_XVE_GFP_suc_24h	R1067	AT2G29210	F16P2.41<br>F16P2_41	nucleus	mRNA processing; RNA splicing	protein binding	splicing factor PWI domain-containing protein [Source:NCBI gene (formerly Entrezgene);Acc:817470]	PWI domain; PWI domain superfamily	Q9LV27	GFP
Q8LE63	Q8LE63_S234	4.782400092499207	0.62776917484493	10.88954855903827	7.618086844867055	1.1000863362995087e-5	5.133736236064374e-5	At_XVE_LST8_suc_24h	At_XVE_GFP_suc_24h	R1067	AT4G11860	T26M18.70<br>T26M18_70	cytosol	NA	cysteine-type deubiquitinase activity; K48-linked deubiquitinase activity	FAM63A-like protein (DUF544) [Source:NCBI gene (formerly Entrezgene);Acc:826793]	MINDY deubiquitinase; MINDY deubiquitinase domain	Q9LV27	GFP
Q8LPK2	Q8LPK2_S559	6.453743701773287	0.3245034845809258	10.384104867588809	19.888056703328957	1.3240805210023747e-9	1.9194141157579377e-8	At_XVE_LST8_suc_24h	At_XVE_GFP_suc_24h	R1067	AT4G25960	ATP-binding cassette B2;<br>F20B18.70;<br>F20B18_70;<br>P-glycoprotein 2;<br>PGP2	cytosol; membrane	transmembrane transport	ABC-type transporter activity; ATP binding; ATP hydrolysis activity; nucleotide binding	P-glycoprotein 2 [Source:NCBI gene (formerly Entrezgene);Acc:828702]	ABC transporter-like, ATP-binding domain; AAA+ ATPase domain; ABC transporter type 1, transmembrane domain; ABC transporter-like, conserved site; P-loop containing nucleoside triphosphate hydrolase; ABC transporter type 1, transmembrane domain superfamily; Type 1 protein exporter	Q9LV27	GFP
Q8W4D8	Q8W4D8_S133	4.468784256970245	0.19335447328781308	11.178782036900254	23.111874170701732	8.618808394486564e-11	1.8099497628421782e-9	At_XVE_LST8_suc_24h	At_XVE_GFP_suc_24h	R1067	AT3G20550	DAWDLE	nucleus	cell division; miRNA processing; regulation of developmental growth; RNA-mediated gene silencing	protein binding; RNA binding	SMAD/FHA domain-containing protein [Source:NCBI gene (formerly Entrezgene);Acc:821601]	Forkhead-associated (FHA) domain; SMAD/FHA domain superfamily	Q9LV27	GFP
Q93VG5	Q93VG5_Y84	5.05832647843027	0.7019154988496301	10.239334108184956	7.206460730273609	2.5594780937253587e-5	1.1621414047185411e-4	At_XVE_LST8_suc_24h	At_XVE_GFP_suc_24h	R1067	AT5G20290	F5O24.180;<br>F5O24_180	chloroplast; cytosolic ribosome; cytosolic small ribosomal subunit; nucleolus; plant-type cell wall; plasmodesma; polysomal ribosome; ribonucleoprotein complex; ribosome	translation	mRNA binding; protein binding; structural constituent of ribosome	Ribosomal protein S8e family protein [Source:NCBI gene (formerly Entrezgene);Acc:832151]	Ribosomal protein S8e; Ribosomal protein S8e, conserved site; Ribosomal protein S8e/ribosomal biogenesis NSA2; Ribosomal protein S8e subdomain, eukaryotes	Q9LV27	GFP
Q96327	Q96327_S2	5.599119004404237	0.711385575044034	11.265072586701164	7.870723276976284	6.58408616093734e-6	3.351898409204464e-5	At_XVE_LST8_suc_24h	At_XVE_GFP_suc_24h	R1067	AT3G51800	A. THALIANA ERBB-3 BINDING PROTEIN 1;<br>ATEBP1;<br>EBP1;<br>ERBB-3 BINDING PROTEIN 1	cytosol; nucleolus; nucleus; ribonucleoprotein complex	auxin-activated signaling pathway; cell cycle G1/S phase transition; regulation of cell division; regulation of cell growth; rRNA processing	mRNA binding; protein binding; RNA binding	metallopeptidase M24 family protein [Source:NCBI gene (formerly Entrezgene);Acc:824343]	Peptidase M24; Peptidase M24, methionine aminopeptidase; PA2G4 family; Creatinase/aminopeptidase-like; Winged helix-like DNA-binding domain superfamily; Winged helix DNA-binding domain superfamily; Proliferation-associated protein 2G4/ARX1	Q9LV27	GFP
Q9C8E6	Q9C8E6_S328	4.857692699323795	1.1423637641436122	10.01522917967407	4.2523168642043085	0.00167758935077492	0.00655430257977181	At_XVE_LST8_suc_24h	At_XVE_GFP_suc_24h	R1067	AT1G42550	PLASTID MOVEMENT IMPAIRED1;<br>T8D8.2;<br>T8D8_2	cytoplasm; cytosol; nucleus; plasma membrane	abscisic acid homeostasis; abscisic acid-activated signaling pathway; actin filament-based movement; chloroplast avoidance movement; chloroplast relocation; nuclear migration along microfilament; regulation of abscisic acid-activated signaling pathway; regulation of seed germination; response to blue light; response to osmotic stress	molecular_function	plastid movement impaired1 [Source:NCBI gene (formerly Entrezgene);Acc:840860]	NT-type C2 domain; Protein PLASTID MOVEMENT IMPAIRED 1-like	Q9LV27	GFP
Q9FF53	Q9FF53_S283	4.263833584184158	0.210659550063855	11.144006763207686	20.24040012850928	3.8572643614827244e-10	6.480204127290978e-9	At_XVE_LST8_suc_24h	At_XVE_GFP_suc_24h	R1067	AT5G60660	MUP24.9;<br>MUP24_9;<br>PIP2F;<br>plasma membrane intrinsic protein 2;4	membrane; plasma membrane; plasmodesma	hydrogen peroxide transmembrane transport; root hair elongation; transmembrane transport; water transport	channel activity; water channel activity	plasma membrane intrinsic protein 2;4 [Source:NCBI gene (formerly Entrezgene);Acc:836187]	Major intrinsic protein; Major intrinsic protein, conserved site; Aquaporin-like; Aquaporin transporter	Q9LV27	GFP
Q9FF53	Q9FF53_S286	4.388412094462336	0.46577282066858056	9.51309542637333	9.421786544270905	3.941288454701957e-6	2.2814039467450814e-5	At_XVE_LST8_suc_24h	At_XVE_GFP_suc_24h	R1067	AT5G60660	MUP24.9;<br>MUP24_9;<br>PIP2F;<br>plasma membrane intrinsic protein 2;4	membrane; plasma membrane; plasmodesma	hydrogen peroxide transmembrane transport; root hair elongation; transmembrane transport; water transport	channel activity; water channel activity	plasma membrane intrinsic protein 2;4 [Source:NCBI gene (formerly Entrezgene);Acc:836187]	Major intrinsic protein; Major intrinsic protein, conserved site; Aquaporin-like; Aquaporin transporter	Q9LV27	GFP
Q9FMF5	Q9FMF5_S222	4.718089082998151	0.07603630449290379	12.306618116278663	62.05047857682872	9.670671683045268e-17	1.624672842751605e-14	At_XVE_LST8_suc_24h	At_XVE_GFP_suc_24h	R1067	AT5G64330	JK218;<br>MSJ1.17;<br>MSJ1_17;<br>NON-PHOTOTROPIC HYPOCOTYL 3;<br>ROOT PHOTOTROPISM 3;<br>RPT3	membrane; plasma membrane	blue light signaling pathway; phototropism; protein ubiquitination; signal transduction	protein binding	Phototropic-responsive NPH3 family protein [Source:NCBI gene (formerly Entrezgene);Acc:836554]	BTB/POZ domain; SKP1/BTB/POZ domain superfamily; NPH3 domain; NPH3/RPT2-like family	Q9LV27	GFP
Q9FXI5	Q9FXI5_S706	2.275136549822561	0.4140631707700717	8.497078366156714	5.494660502143377	4.6825350859932863e-4	0.00191869730352895	At_XVE_LST8_suc_24h	At_XVE_GFP_suc_24h	R1067	AT1G19870	F6F9.8;<br>F6F9_8;<br>IQ-domain 32;<br>IQD32	chloroplast envelope; cytoplasm; cytoskeleton; microtubule associated complex; nucleus; plasma membrane	NA	calmodulin binding; protein binding	IQ-domain 32 [Source:NCBI gene (formerly Entrezgene);Acc:838575]	IQ motif, EF-hand binding site; Domain of unknown function DUF4005	Q9LV27	GFP
Q9FXI5	Q9FXI5_T705	4.886693731156537	0.7504742919789787	10.134349743031082	6.5114738551143025	6.38915850521487e-5	2.6834465721902454e-4	At_XVE_LST8_suc_24h	At_XVE_GFP_suc_24h	R1067	AT1G19870	F6F9.8;<br>F6F9_8;<br>IQ-domain 32;<br>IQD32	chloroplast envelope; cytoplasm; cytoskeleton; microtubule associated complex; nucleus; plasma membrane	NA	calmodulin binding; protein binding	IQ-domain 32 [Source:NCBI gene (formerly Entrezgene);Acc:838575]	IQ motif, EF-hand binding site; Domain of unknown function DUF4005	Q9LV27	GFP
Q9LF79	Q9LF79_S7	5.226380379374537	0.04363851816573314	9.379829669097443	119.76530365961229	2.938969420953077e-16	2.4687343136005848e-14	At_XVE_LST8_suc_24h	At_XVE_GFP_suc_24h	R1067	AT5G57110	''AUTOINHIBITED CA2+ -ATPASE;<br>'autoinhibited Ca2+ -ATPase;<br>AT-ACA8;<br>AUTOINHIBITED CA2+ -ATPASE;<br>ISOFORM 8;<br>isoform 8';<br>ISOFORM 8'';<br>MUL3.5;<br>MUL3_5	cellular anatomical entity; membrane; plasma membrane; plasmodesma; plastid	calcium ion transmembrane transport; calcium ion transport; monoatomic ion transport; response to nematode	ATP binding; ATP hydrolysis activity; calmodulin binding; metal ion binding; nucleotide binding; P-type calcium transporter activity; protein binding; protein self-association; transporter activity	autoinhibited Ca2+ -ATPase [Source:NCBI gene (formerly Entrezgene);Acc:835815]	P-type ATPase; Cation-transporting P-type ATPase, N-terminal; Cation-transporting P-type ATPase, C-terminal; P-type ATPase, subfamily IIB; P-type ATPase, A domain superfamily; P-type ATPase, phosphorylation site; HAD superfamily; P-type ATPase, transmembrane domain superfamily; P-type ATPase, cytoplasmic domain N; Calcium-transporting P-type ATPase, N-terminal autoinhibitory domain; HAD-like superfamily; P-type ATPase, haloacid dehalogenase domain	Q9LV27	GFP
Q9LF98	Q9LF98_S350	5.392522122115568	0.4390978747582202	10.503688507071818	12.280911459853556	1.454140387280968e-7	1.0178982710966772e-6	At_XVE_LST8_suc_24h	At_XVE_GFP_suc_24h	R1067	AT3G52930	AtFBA8;<br>fructose-bisphosphate aldolase 8	apoplast; chloroplast; cytoplasm; cytosol; membrane; mitochondrial envelope; mitochondrial outer membrane; mitochondrion; nucleolus; plant-type cell wall; plant-type vacuole; plasma membrane; plasmodesma	gluconeogenesis; glycolytic process	copper ion binding; fructose-bisphosphate aldolase activity; lyase activity; mRNA binding; protein binding	Aldolase superfamily protein [Source:NCBI gene (formerly Entrezgene);Acc:824459]	Fructose-bisphosphate aldolase, class-I; Aldolase-type TIM barrel; Fructose-bisphosphate aldolase class-I active site	Q9LV27	GFP
