protein	Index	logFC	se	df	t	pval	adjPval	group1	group2	batch	gene	Synonyms	GO cellular component	GO biological process	GO molecular function	Description	Interpro terms	bait	control
Q8LPK2	Q8LPK2_S559	6.357722535389342	0.36165296333936053	10.384104867588809	17.579622400117074	4.608202252068974e-9	3.6476835672584315e-8	At_XVE_LST8_suc_24h	At_XVE_GFP_suc_4h	R1067	AT4G25960	ATP-binding cassette B2;<br>F20B18.70;<br>F20B18_70;<br>P-glycoprotein 2;<br>PGP2	cytosol; membrane	transmembrane transport	ABC-type transporter activity; ATP binding; ATP hydrolysis activity; nucleotide binding	P-glycoprotein 2 [Source:NCBI gene (formerly Entrezgene);Acc:828702]	ABC transporter-like, ATP-binding domain; AAA+ ATPase domain; ABC transporter type 1, transmembrane domain; ABC transporter-like, conserved site; P-loop containing nucleoside triphosphate hydrolase; ABC transporter type 1, transmembrane domain superfamily; Type 1 protein exporter	Q9LV27	GFP
Q8W4D8	Q8W4D8_S133	4.464613884551558	0.19335447328781313	11.178782036900254	23.09030563728342	8.707511710549419e-11	1.828577459215378e-9	At_XVE_LST8_suc_24h	At_XVE_GFP_suc_4h	R1067	AT3G20550	DAWDLE	nucleus	cell division; miRNA processing; regulation of developmental growth; RNA-mediated gene silencing	protein binding; RNA binding	SMAD/FHA domain-containing protein [Source:NCBI gene (formerly Entrezgene);Acc:821601]	Forkhead-associated (FHA) domain; SMAD/FHA domain superfamily	Q9LV27	GFP
Q93V62	Q93V62_S219	1.968161793520652	0.49275706144638287	9.636453394853984	3.99418282864082	0.0027364427490462	0.00851337744147708	At_XVE_LST8_suc_24h	At_XVE_GFP_suc_4h	R1067	AT4G27450	F27G19.50<br>F27G19_50	plasma membrane; plasmodesma	cellular response to hypoxia	protein binding	aluminum induced protein with YGL and LRDR motifs [Source:NCBI gene (formerly Entrezgene);Acc:828854]	Domain of unknown function DUF3700; Nucleophile aminohydrolases, N-terminal; Stem-specific protein TSJT1-like	Q9LV27	GFP
Q93VG5	Q93VG5_Y84	5.0068256602865375	0.7036843304036562	10.239334108184956	7.115158664133475	2.8586787585318726e-5	1.1168791428682664e-4	At_XVE_LST8_suc_24h	At_XVE_GFP_suc_4h	R1067	AT5G20290	F5O24.180;<br>F5O24_180	chloroplast; cytosolic ribosome; cytosolic small ribosomal subunit; nucleolus; plant-type cell wall; plasmodesma; polysomal ribosome; ribonucleoprotein complex; ribosome	translation	mRNA binding; protein binding; structural constituent of ribosome	Ribosomal protein S8e family protein [Source:NCBI gene (formerly Entrezgene);Acc:832151]	Ribosomal protein S8e; Ribosomal protein S8e, conserved site; Ribosomal protein S8e/ribosomal biogenesis NSA2; Ribosomal protein S8e subdomain, eukaryotes	Q9LV27	GFP
Q944G9	Q944G9_S157	5.277603262107198	0.28235387705604725	9.215225866844143	18.691449599112797	1.2191592836891164e-8	7.877644602298906e-8	At_XVE_LST8_suc_24h	At_XVE_GFP_suc_4h	R1067	AT4G38970	AtFBA2;<br>F19H22.70;<br>F19H22_70;<br>fructose-bisphosphate aldolase 2	apoplast; chloroplast; chloroplast envelope; chloroplast stroma; plasma membrane; plastid; plastoglobule; thylakoid	gluconeogenesis; glycolytic process; response to abscisic acid	fructose-bisphosphate aldolase activity; lyase activity; mRNA binding	fructose-bisphosphate aldolase 2 [Source:NCBI gene (formerly Entrezgene);Acc:830052]	Fructose-bisphosphate aldolase, class-I; Aldolase-type TIM barrel; Fructose-bisphosphate aldolase class-I active site	Q9LV27	GFP
Q9C8E6	Q9C8E6_S328	4.937311780811929	1.1306855635002275	10.01522917967407	4.366653241355315	0.00140138583707606	0.00461632981625056	At_XVE_LST8_suc_24h	At_XVE_GFP_suc_4h	R1067	AT1G42550	PLASTID MOVEMENT IMPAIRED1;<br>T8D8.2;<br>T8D8_2	cytoplasm; cytosol; nucleus; plasma membrane	abscisic acid homeostasis; abscisic acid-activated signaling pathway; actin filament-based movement; chloroplast avoidance movement; chloroplast relocation; nuclear migration along microfilament; regulation of abscisic acid-activated signaling pathway; regulation of seed germination; response to blue light; response to osmotic stress	molecular_function	plastid movement impaired1 [Source:NCBI gene (formerly Entrezgene);Acc:840860]	NT-type C2 domain; Protein PLASTID MOVEMENT IMPAIRED 1-like	Q9LV27	GFP
Q9FF53	Q9FF53_S283	4.283228227352657	0.210659550063855	11.144006763207686	20.332466418229448	3.6715554004811253e-10	5.140177560673576e-9	At_XVE_LST8_suc_24h	At_XVE_GFP_suc_4h	R1067	AT5G60660	MUP24.9;<br>MUP24_9;<br>PIP2F;<br>plasma membrane intrinsic protein 2;4	membrane; plasma membrane; plasmodesma	hydrogen peroxide transmembrane transport; root hair elongation; transmembrane transport; water transport	channel activity; water channel activity	plasma membrane intrinsic protein 2;4 [Source:NCBI gene (formerly Entrezgene);Acc:836187]	Major intrinsic protein; Major intrinsic protein, conserved site; Aquaporin-like; Aquaporin transporter	Q9LV27	GFP
Q9FF53	Q9FF53_S286	4.355153889307408	0.4657728206685805	9.51309542637333	9.350382195027878	4.209859525563937e-6	1.911503784580382e-5	At_XVE_LST8_suc_24h	At_XVE_GFP_suc_4h	R1067	AT5G60660	MUP24.9;<br>MUP24_9;<br>PIP2F;<br>plasma membrane intrinsic protein 2;4	membrane; plasma membrane; plasmodesma	hydrogen peroxide transmembrane transport; root hair elongation; transmembrane transport; water transport	channel activity; water channel activity	plasma membrane intrinsic protein 2;4 [Source:NCBI gene (formerly Entrezgene);Acc:836187]	Major intrinsic protein; Major intrinsic protein, conserved site; Aquaporin-like; Aquaporin transporter	Q9LV27	GFP
Q9FG81	Q9FG81_S216	1.576783744145804	0.4054487962110056	10.236030839087334	3.888983661762327	0.0028854714924893	0.00881380383160368	At_XVE_LST8_suc_24h	At_XVE_GFP_suc_4h	R1067	AT5G43830	MQD19.19<br>MQD19_19	cytosol; plastid	biological_process	identical protein binding; protein binding	aluminum induced protein with YGL and LRDR motifs [Source:NCBI gene (formerly Entrezgene);Acc:834405]	Domain of unknown function DUF3700; Nucleophile aminohydrolases, N-terminal; Stem-specific protein TSJT1-like	Q9LV27	GFP
Q9FG81	Q9FG81_S243	5.451290699518279	0.21890241244408973	7.769297951919564	24.90283518876524	1.083686152017112e-8	7.282370941554992e-8	At_XVE_LST8_suc_24h	At_XVE_GFP_suc_4h	R1067	AT5G43830	MQD19.19<br>MQD19_19	cytosol; plastid	biological_process	identical protein binding; protein binding	aluminum induced protein with YGL and LRDR motifs [Source:NCBI gene (formerly Entrezgene);Acc:834405]	Domain of unknown function DUF3700; Nucleophile aminohydrolases, N-terminal; Stem-specific protein TSJT1-like	Q9LV27	GFP
Q9FJP3	Q9FJP3_T75	7.964447218099541	0.3505227518441709	9.31430702060316	22.72162698768333	1.7862710102883883e-9	1.6671862762691624e-8	At_XVE_LST8_suc_24h	At_XVE_GFP_suc_4h	R1067	AT5G65220	MQN23.16;<br>MQN23_16	chloroplast; chloroplast envelope; chloroplast nucleoid; chloroplast stroma; plastid; ribonucleoprotein complex; ribosome	translation	structural constituent of ribosome	Ribosomal L29 family protein [Source:NCBI gene (formerly Entrezgene);Acc:836647]	Ribosomal protein L29/L35; Ribosomal protein L29/L35 superfamily	Q9LV27	GFP
Q9FKA5	Q9FKA5_S337	5.089884766556683	0.3951828258608082	9.411504636233897	12.879822789539563	2.732384062623265e-7	1.434501632877214e-6	At_XVE_LST8_suc_24h	At_XVE_GFP_suc_4h	R1067	NA	NA	NA	NA	NA	NA	NA	Q9LV27	GFP
Q9FMF5	Q9FMF5_S222	4.64722073452124	0.0760363044929038	12.306618116278663	61.11844553091016	1.1644012052202728e-16	1.3185589945204327e-14	At_XVE_LST8_suc_24h	At_XVE_GFP_suc_4h	R1067	AT5G64330	JK218;<br>MSJ1.17;<br>MSJ1_17;<br>NON-PHOTOTROPIC HYPOCOTYL 3;<br>ROOT PHOTOTROPISM 3;<br>RPT3	membrane; plasma membrane	blue light signaling pathway; phototropism; protein ubiquitination; signal transduction	protein binding	Phototropic-responsive NPH3 family protein [Source:NCBI gene (formerly Entrezgene);Acc:836554]	BTB/POZ domain; SKP1/BTB/POZ domain superfamily; NPH3 domain; NPH3/RPT2-like family	Q9LV27	GFP
Q9FXI5	Q9FXI5_S706	7.476364009861484	0.41406317077007165	8.497078366156714	18.056095150788217	4.4875029212570584e-8	2.6925017527542346e-7	At_XVE_LST8_suc_24h	At_XVE_GFP_suc_4h	R1067	AT1G19870	F6F9.8;<br>F6F9_8;<br>IQ-domain 32;<br>IQD32	chloroplast envelope; cytoplasm; cytoskeleton; microtubule associated complex; nucleus; plasma membrane	NA	calmodulin binding; protein binding	IQ-domain 32 [Source:NCBI gene (formerly Entrezgene);Acc:838575]	IQ motif, EF-hand binding site; Domain of unknown function DUF4005	Q9LV27	GFP
Q9LF79	Q9LF79_S7	5.201583450417313	0.04062094179689062	9.379829669097443	128.05176887394262	1.569713088714801e-16	1.3185589945204327e-14	At_XVE_LST8_suc_24h	At_XVE_GFP_suc_4h	R1067	AT5G57110	''AUTOINHIBITED CA2+ -ATPASE;<br>'autoinhibited Ca2+ -ATPase;<br>AT-ACA8;<br>AUTOINHIBITED CA2+ -ATPASE;<br>ISOFORM 8;<br>isoform 8';<br>ISOFORM 8'';<br>MUL3.5;<br>MUL3_5	cellular anatomical entity; membrane; plasma membrane; plasmodesma; plastid	calcium ion transmembrane transport; calcium ion transport; monoatomic ion transport; response to nematode	ATP binding; ATP hydrolysis activity; calmodulin binding; metal ion binding; nucleotide binding; P-type calcium transporter activity; protein binding; protein self-association; transporter activity	autoinhibited Ca2+ -ATPase [Source:NCBI gene (formerly Entrezgene);Acc:835815]	P-type ATPase; Cation-transporting P-type ATPase, N-terminal; Cation-transporting P-type ATPase, C-terminal; P-type ATPase, subfamily IIB; P-type ATPase, A domain superfamily; P-type ATPase, phosphorylation site; HAD superfamily; P-type ATPase, transmembrane domain superfamily; P-type ATPase, cytoplasmic domain N; Calcium-transporting P-type ATPase, N-terminal autoinhibitory domain; HAD-like superfamily; P-type ATPase, haloacid dehalogenase domain	Q9LV27	GFP
Q9LF98	Q9LF98_S350	1.570630233242703	0.47280492796184015	10.503688507071818	3.3219413342694	0.00723301323319833	0.02131835479258457	At_XVE_LST8_suc_24h	At_XVE_GFP_suc_4h	R1067	AT3G52930	AtFBA8;<br>fructose-bisphosphate aldolase 8	apoplast; chloroplast; cytoplasm; cytosol; membrane; mitochondrial envelope; mitochondrial outer membrane; mitochondrion; nucleolus; plant-type cell wall; plant-type vacuole; plasma membrane; plasmodesma	gluconeogenesis; glycolytic process	copper ion binding; fructose-bisphosphate aldolase activity; lyase activity; mRNA binding; protein binding	Aldolase superfamily protein [Source:NCBI gene (formerly Entrezgene);Acc:824459]	Fructose-bisphosphate aldolase, class-I; Aldolase-type TIM barrel; Fructose-bisphosphate aldolase class-I active site	Q9LV27	GFP
Q9LQ55	Q9LQ55_S533	3.2965760009470175	0.6908120791977107	12.87729430607701	4.772030050162941	3.743200303526581e-4	0.00125771530198493	At_XVE_LST8_suc_24h	At_XVE_GFP_suc_4h	R1067	AT1G59610	ADL3;<br>CF1;<br>DRP2B;<br>Dynamin related protein 2B;<br>DYNAMIN-LIKE 3;<br>T30E16.17;<br>T30E16_17	cell plate; clathrin-coated endocytic vesicle; clathrin-coated vesicle; cytoplasm; cytoplasmic vesicle; cytoskeleton; cytosol; intracellular organelle; membrane; microtubule; nucleus; plant-type vacuole; plasma membrane; plasmodesma	clathrin-dependent endocytosis; regulation of establishment of cell polarity; root hair initiation	clathrin binding; GTP binding; GTPase activity; hydrolase activity; nucleotide binding; protein binding	dynamin-like 3 [Source:NCBI gene (formerly Entrezgene);Acc:842251]	Dynamin stalk domain; Dynamin, GTPase domain; Pleckstrin homology domain; Dynamin GTPase effector; PH-like domain superfamily; Dynamin, GTPase region, conserved site; GTPase effector domain; Dynamin; P-loop containing nucleoside triphosphate hydrolase; Dynamin-type guanine nucleotide-binding (G) domain; Dynamin, N-terminal	Q9LV27	GFP
Q9LQ55	Q9LQ55_S719	5.800135689424478	0.2000257351632387	9.3380336005133735	28.996947241269	1.8173130044897686e-10	3.053085847542811e-9	At_XVE_LST8_suc_24h	At_XVE_GFP_suc_4h	R1067	AT1G59610	ADL3;<br>CF1;<br>DRP2B;<br>Dynamin related protein 2B;<br>DYNAMIN-LIKE 3;<br>T30E16.17;<br>T30E16_17	cell plate; clathrin-coated endocytic vesicle; clathrin-coated vesicle; cytoplasm; cytoplasmic vesicle; cytoskeleton; cytosol; intracellular organelle; membrane; microtubule; nucleus; plant-type vacuole; plasma membrane; plasmodesma	clathrin-dependent endocytosis; regulation of establishment of cell polarity; root hair initiation	clathrin binding; GTP binding; GTPase activity; hydrolase activity; nucleotide binding; protein binding	dynamin-like 3 [Source:NCBI gene (formerly Entrezgene);Acc:842251]	Dynamin stalk domain; Dynamin, GTPase domain; Pleckstrin homology domain; Dynamin GTPase effector; PH-like domain superfamily; Dynamin, GTPase region, conserved site; GTPase effector domain; Dynamin; P-loop containing nucleoside triphosphate hydrolase; Dynamin-type guanine nucleotide-binding (G) domain; Dynamin, N-terminal	Q9LV27	GFP
Q9LQ55	Q9LQ55_S844	4.897322551297659	0.535413757493587	11.275285886833457	9.146799989270574	1.4886127711821655e-6	7.145341301674394e-6	At_XVE_LST8_suc_24h	At_XVE_GFP_suc_4h	R1067	AT1G59610	ADL3;<br>CF1;<br>DRP2B;<br>Dynamin related protein 2B;<br>DYNAMIN-LIKE 3;<br>T30E16.17;<br>T30E16_17	cell plate; clathrin-coated endocytic vesicle; clathrin-coated vesicle; cytoplasm; cytoplasmic vesicle; cytoskeleton; cytosol; intracellular organelle; membrane; microtubule; nucleus; plant-type vacuole; plasma membrane; plasmodesma	clathrin-dependent endocytosis; regulation of establishment of cell polarity; root hair initiation	clathrin binding; GTP binding; GTPase activity; hydrolase activity; nucleotide binding; protein binding	dynamin-like 3 [Source:NCBI gene (formerly Entrezgene);Acc:842251]	Dynamin stalk domain; Dynamin, GTPase domain; Pleckstrin homology domain; Dynamin GTPase effector; PH-like domain superfamily; Dynamin, GTPase region, conserved site; GTPase effector domain; Dynamin; P-loop containing nucleoside triphosphate hydrolase; Dynamin-type guanine nucleotide-binding (G) domain; Dynamin, N-terminal	Q9LV27	GFP
Q9LVI6	Q9LVI6_S331	4.828386422901872	0.31337846209556675	9.770172178121438	15.4075247884439	3.53982318070868e-8	2.20255664577429e-7	At_XVE_LST8_suc_24h	At_XVE_GFP_suc_4h	R1067	AT3G17840	receptor-like kinase 902	cytosol; membrane; plasma membrane; plasmodesma	phosphorylation; protein phosphorylation	ATP binding; kinase activity; nucleotide binding; protein binding; protein kinase activity	receptor-like kinase 902 [Source:NCBI gene (formerly Entrezgene);Acc:821053]	Protein kinase domain; Leucine-rich repeat; Protein kinase-like domain superfamily; Leucine-rich repeat-containing N-terminal, plant-type; Protein kinase, ATP binding site; Leucine-rich repeat domain superfamily	Q9LV27	GFP
Q9M8T0	Q9M8T0_S621	5.3307721287283965	0.2753790067399717	10.299373652279414	19.357946678056003	1.9548128676942832e-9	1.72846611459284e-8	At_XVE_LST8_suc_24h	At_XVE_GFP_suc_4h	R1067	AT3G02880	F13E7.17;<br>F13E7_17	cytosol; membrane; plant-type cell wall; plasma membrane; plasmodesma	phosphorylation; protein phosphorylation	ATP binding; kinase activity; nucleotide binding; protein binding; protein kinase activity	Leucine-rich repeat protein kinase family protein [Source:NCBI gene (formerly Entrezgene);Acc:821198]	Protein kinase domain; Leucine-rich repeat; Protein kinase-like domain superfamily; Leucine-rich repeat-containing N-terminal, plant-type; Leucine-rich repeat domain superfamily	Q9LV27	GFP
Q9MB58	Q9MB58_S301	4.670823960776939	0.08428149486831493	11.289829660732254	55.419329807508014	4.114957417679567e-15	2.304376153900559e-13	At_XVE_LST8_suc_24h	At_XVE_GFP_suc_4h	R1067	AT1G07110	''fructose-2;<br>6-BISPHOSPHATASE;<br>6-bisphosphatase'';<br>ATF2KP;<br>F10K1.19;<br>F10K1_19;<br>FKFBP;<br>FRUCTOSE-2;<br>FRUCTOSE-6-PHOSPHATE 2-KINASE	cytoplasm; membrane	carbohydrate metabolic process; carbohydrate phosphorylation; fructose 2,6-bisphosphate metabolic process; fructose 6-phosphate metabolic process; fructose metabolic process; metabolic process; phosphorylation; regulation of carbon utilization	6-phosphofructo-2-kinase activity; ATP binding; carbohydrate binding; catalytic activity; fructose-2,6-bisphosphate 2-phosphatase activity; hydrolase activity; kinase activity; nucleotide binding; starch binding; transferase activity	fructose-2,6-bisphosphatase [Source:NCBI gene (formerly Entrezgene);Acc:837221]	Phosphoglycerate/bisphosphoglycerate mutase, active site; Carbohydrate binding module family 20; Fructose-2,6-bisphosphatase; Histidine phosphatase superfamily, clade-1; 6-phosphofructo-2-kinase; Immunoglobulin-like fold; Carbohydrate-binding-like fold; P-loop containing nucleoside triphosphate hydrolase; Histidine phosphatase superfamily	Q9LV27	GFP
Q9S791	Q9S791_S87	4.749360861378458	0.21381722572922823	8.81935833688536	22.21224620785655	4.7767284809336604e-9	3.6476835672584315e-8	At_XVE_LST8_suc_24h	At_XVE_GFP_suc_4h	R1067	AT1G70770	F5A18.5<br>F5A18_5	endoplasmic reticulum; endoplasmic reticulum membrane; Golgi apparatus; membrane; plant-type vacuole; plasma membrane; plasmodesma	NA	mRNA binding	transmembrane protein (Protein of unknown function DUF2359, transmembrane) [Source:NCBI gene (formerly Entrezgene);Acc:843414]	Transmembrane protein 214	Q9LV27	GFP
Q9SAG7	Q9SAG7_S187	4.900728359823959	0.17609610524031047	9.696087301680029	27.82985093927066	1.4140531538946426e-10	2.63956588727e-9	At_XVE_LST8_suc_24h	At_XVE_GFP_suc_4h	R1067	AT1G80930	F23A5.29<br>F23A5_29	NA	regulation of translation	protein binding; RNA binding	MIF4G domain-containing protein / MA3 domain-containing protein [Source:NCBI gene (formerly Entrezgene);Acc:844433]	MIF4G-like, type 3; Initiation factor eIF-4 gamma, MA3; Armadillo-type fold	Q9LV27	GFP
Q9SE83	Q9SE83_S533	4.4867509110866735	0.7666541821815814	13.06260027398416	5.852379097860305	5.554660164198607e-5	2.0286584947507952e-4	At_XVE_LST8_suc_24h	At_XVE_GFP_suc_4h	R1067	AT1G10290	DRP2A;<br>dynamin-like protein 6;<br>DYNAMIN-RELATED PROTEIN 2A;<br>F14N23.17;<br>F14N23_17	clathrin-coated vesicle; cytoplasm; cytoplasmic vesicle; cytoskeleton; cytosol; extracellular region; Golgi apparatus; Golgi membrane; intracellular organelle; membrane; microtubule; phragmoplast; plant-type vacuole; plasma membrane; plasmodesma	Golgi to vacuole transport	GTP binding; GTPase activity; hydrolase activity; lipid binding; nucleotide binding	dynamin-like protein 6 [Source:NCBI gene (formerly Entrezgene);Acc:837568]	Dynamin stalk domain; Dynamin, GTPase domain; Pleckstrin homology domain; Dynamin GTPase effector; PH-like domain superfamily; Dynamin, GTPase region, conserved site; GTPase effector domain; Dynamin; P-loop containing nucleoside triphosphate hydrolase; Dynamin-type guanine nucleotide-binding (G) domain; Dynamin, N-terminal	Q9LV27	GFP
Q9SE83	Q9SE83_S837	4.657026998398799	0.5116975731457427	11.41893835167492	9.101131689503587	1.4246295055676964e-6	7.039345792216853e-6	At_XVE_LST8_suc_24h	At_XVE_GFP_suc_4h	R1067	AT1G10290	DRP2A;<br>dynamin-like protein 6;<br>DYNAMIN-RELATED PROTEIN 2A;<br>F14N23.17;<br>F14N23_17	clathrin-coated vesicle; cytoplasm; cytoplasmic vesicle; cytoskeleton; cytosol; extracellular region; Golgi apparatus; Golgi membrane; intracellular organelle; membrane; microtubule; phragmoplast; plant-type vacuole; plasma membrane; plasmodesma	Golgi to vacuole transport	GTP binding; GTPase activity; hydrolase activity; lipid binding; nucleotide binding	dynamin-like protein 6 [Source:NCBI gene (formerly Entrezgene);Acc:837568]	Dynamin stalk domain; Dynamin, GTPase domain; Pleckstrin homology domain; Dynamin GTPase effector; PH-like domain superfamily; Dynamin, GTPase region, conserved site; GTPase effector domain; Dynamin; P-loop containing nucleoside triphosphate hydrolase; Dynamin-type guanine nucleotide-binding (G) domain; Dynamin, N-terminal	Q9LV27	GFP
Q9XGM1	Q9XGM1_S241	5.345544577481727	0.22774629939333585	9.827899687228737	23.47148819419256	5.854618962899607e-10	7.025542755479528e-9	At_XVE_LST8_suc_24h	At_XVE_GFP_suc_4h	R1067	AT3G58730	VHA-D	cytosol; Golgi apparatus; membrane; plant-type vacuole; plasma membrane; vacuolar membrane; vacuole	monoatomic ion transport; proton transmembrane transport	proton-transporting ATPase activity, rotational mechanism	vacuolar ATP synthase subunit D (VATD) / V-ATPase D subunit / vacuolar proton pump D subunit (VATPD) [Source:NCBI gene (formerly Entrezgene);Acc:825042]	ATPase, V1 complex, subunit D	Q9LV27	GFP
Q9ZV07	Q9ZV07_S282	5.1439187236583255	0.2764924943033477	10.504529256105984	18.604189370922985	2.218466283130237e-9	1.8635116778293995e-8	At_XVE_LST8_suc_24h	At_XVE_GFP_suc_4h	R1067	AT2G39010	PIP2;6;<br>PLASMA MEMBRANE INTRINSIC PROTEIN 2;6;<br>plasma membrane intrinsic protein 2E;<br>T7F6.18;<br>T7F6_18	Golgi apparatus; membrane; plasma membrane	response to nematode; transmembrane transport; water transport	channel activity; mRNA binding; water channel activity	plasma membrane intrinsic protein 2E [Source:NCBI gene (formerly Entrezgene);Acc:818487]	Major intrinsic protein; Major intrinsic protein, conserved site; Aquaporin-like; Aquaporin transporter	Q9LV27	GFP
F4JTP5	F4JTP5_T443	3.9793467720120264	0.3616409619516736	9.717040208385251	11.00358419172602	8.419511539289706e-7	4.562832060002163e-6	At_XVE_LST8_suc_4h	At_XVE_GFP_suc_4h	R1067	AT4G38470	F20M13.30;<br>F20M13_30;<br>serine/threonine/tyrosine kinase 46	cytoplasm; cytosol	cellular response to hypoxia; chloroplast organization; phosphorylation; protein phosphorylation; response to abscisic acid	ATP binding; kinase activity; nucleotide binding; protein kinase activity; protein serine kinase activity; protein serine/threonine kinase activity; protein serine/threonine/tyrosine kinase activity; transferase activity	ACT-like protein tyrosine kinase family protein [Source:NCBI gene (formerly Entrezgene);Acc:830003]	Protein kinase domain; Serine-threonine/tyrosine-protein kinase, catalytic domain; ACT domain; Serine/threonine-protein kinase, active site; Protein kinase-like domain superfamily; ACT-like domain	Q9LV27	GFP
O23052	O23052_S567	4.156625670493698	0.2639816808096237	8.287070307340775	15.745886827242916	1.822471263157493e-7	1.1775968161940725e-6	At_XVE_LST8_suc_4h	At_XVE_GFP_suc_4h	R1067	AT1G05150	YUP8H12.24;<br>YUP8H12_24	endosome; extracellular region; Golgi apparatus; plasma membrane; plasmodesma; trans-Golgi network	NA	calcium ion binding; metal ion binding; protein binding	Calcium-binding tetratricopeptide family protein [Source:NCBI gene (formerly Entrezgene);Acc:839312]	EF-hand domain; Tetratricopeptide-like helical domain superfamily; EF-hand domain pair; Tetratricopeptide repeat	Q9LV27	GFP
O48549	O48549_S240	5.158081030225733	0.29299223705884725	7.494718602002913	17.604838551370005	2.278661861375522e-7	1.4178340470781023e-6	At_XVE_LST8_suc_4h	At_XVE_GFP_suc_4h	R1067	AT4G31700	AtRPS6;<br>F28M20.110;<br>F28M20_110;<br>RIBOSOMAL PROTEIN S6;<br>RPS6A	cytosolic ribosome; cytosolic small ribosomal subunit; nucleolus; plasma membrane; plasmodesma; polysomal ribosome; ribonucleoprotein complex; ribosome	translation	mRNA binding; structural constituent of ribosome	ribosomal protein S6 [Source:NCBI gene (formerly Entrezgene);Acc:829298]	Ribosomal protein S6e; Ribosomal protein S6, eukaryotic	Q9LV27	GFP
O48549	O48549_S247	5.267277825358685	0.2222016981549186	10.3889987760835	23.704939562101583	2.2009743093178468e-10	5.2823383423628326e-9	At_XVE_LST8_suc_4h	At_XVE_GFP_suc_4h	R1067	AT4G31700	AtRPS6;<br>F28M20.110;<br>F28M20_110;<br>RIBOSOMAL PROTEIN S6;<br>RPS6A	cytosolic ribosome; cytosolic small ribosomal subunit; nucleolus; plasma membrane; plasmodesma; polysomal ribosome; ribonucleoprotein complex; ribosome	translation	mRNA binding; structural constituent of ribosome	ribosomal protein S6 [Source:NCBI gene (formerly Entrezgene);Acc:829298]	Ribosomal protein S6e; Ribosomal protein S6, eukaryotic	Q9LV27	GFP
O80837	O80837_T58	4.859210995530618	0.6550222795750519	9.119113359412736	7.418390407549265	3.749583202779048e-5	1.615205071966359e-4	At_XVE_LST8_suc_4h	At_XVE_GFP_suc_4h	R1067	AT2G45820	F4I18.20	cytosol; plasma membrane; plasmodesma	defense response to virus; membrane raft localization; response to oxygen-containing compound; response to salicylic acid	protein binding	Remorin family protein [Source:NCBI gene (formerly Entrezgene);Acc:819190]	Remorin, C-terminal; Remorin, N-terminal	Q9LV27	GFP
P19456	P19456_T881	7.367901652206922	0.9368617289308274	11.417975400026853	7.864449389575745	6.104244078088828e-6	3.0162147209380093e-5	At_XVE_LST8_suc_4h	At_XVE_GFP_suc_4h	R1067	AT4G30190	AHA2;<br>F9N11.40;<br>F9N11_40;<br>H(+)-ATPase 2;<br>P-TYPE H(+)-ATPASE ISOFORM 2;<br>PLASMA MEMBRANE PROTON ATPASE 2;<br>PMA2	membrane; plasma membrane	monoatomic ion transport; proton export across plasma membrane; proton transmembrane transport; regulation of intracellular pH	ATP binding; ATP hydrolysis activity; magnesium ion binding; metal ion binding; nucleotide binding; P-type proton-exporting transporter activity; protein binding; transporter activity	H[+]-ATPase 2 [Source:NCBI gene (formerly Entrezgene);Acc:829142]	P-type ATPase; Cation-transporting P-type ATPase, N-terminal; P-type ATPase, subfamily IIIA; P-type ATPase, A domain superfamily; P-type ATPase, phosphorylation site; HAD superfamily; P-type ATPase, transmembrane domain superfamily; P-type ATPase, cytoplasmic domain N; HAD-like superfamily; P-type ATPase, haloacid dehalogenase domain	Q9LV27	GFP
