protein	Index	logFC	se	df	t	pval	adjPval	group1	group2	batch	gene	Synonyms	GO cellular component	GO biological process	GO molecular function	Description	Interpro terms	bait	control
Q9LJX0	Q9LJX0_S647	4.84593970136571	0.37014669700203007	8.756095048788065	13.091943655353306	4.757074521541032e-7	2.567809496108706e-6	At_XVE_RAPTOR_suc_24h	At_XVE_LST8_suc_24h	R1067	AT3G28860	Arabidopsis thaliana ATP-binding cassette B19;<br>ATABCB19;<br>ATMDR1;<br>ATMDR11;<br>ATP BINDING CASSETTE SUBFAMILY B19;<br>ATP-binding cassette B19;<br>ATPGP19;<br>MDR1;<br>MDR11;<br>MULTIDRUG RESISTANCE PROTEIN 11;<br>P-GLYCOPROTEIN 19;<br>PGP19	cytosol; membrane; plasma membrane	acropetal auxin transport; anthocyanin accumulation in tissues in response to UV light; auxin export across the plasma membrane; auxin polar transport; auxin transport; auxin-activated signaling pathway; basipetal auxin transport; formation of plant organ boundary; lateral root development; photomorphogenesis; positive gravitropism; regulation of cell size; response to auxin; response to blue light; response to far red light; response to red or far red light; root development; stamen development; transmembrane transport	ABC-type transporter activity; ATP binding; ATP hydrolysis activity; auxin efflux transmembrane transporter activity; nucleotide binding; protein binding	ATP binding cassette subfamily B19 [Source:NCBI gene (formerly Entrezgene);Acc:822519]	ABC transporter-like, ATP-binding domain; AAA+ ATPase domain; ABC transporter type 1, transmembrane domain; ABC transporter-like, conserved site; P-loop containing nucleoside triphosphate hydrolase; ABC transporter type 1, transmembrane domain superfamily; Type 1 protein exporter	Q93YQ1	Q9LV27
Q9LQ55	Q9LQ55_S823	6.388555704822279	0.19410348011815876	10.371937537075718	32.91314355071482	7.834070651615191e-12	2.6322477389427037e-10	At_XVE_RAPTOR_suc_24h	At_XVE_LST8_suc_24h	R1067	AT1G59610	ADL3;<br>CF1;<br>DRP2B;<br>Dynamin related protein 2B;<br>DYNAMIN-LIKE 3;<br>T30E16.17;<br>T30E16_17	cell plate; clathrin-coated endocytic vesicle; clathrin-coated vesicle; cytoplasm; cytoplasmic vesicle; cytoskeleton; cytosol; intracellular organelle; membrane; microtubule; nucleus; plant-type vacuole; plasma membrane; plasmodesma	clathrin-dependent endocytosis; regulation of establishment of cell polarity; root hair initiation	clathrin binding; GTP binding; GTPase activity; hydrolase activity; nucleotide binding; protein binding	dynamin-like 3 [Source:NCBI gene (formerly Entrezgene);Acc:842251]	Dynamin stalk domain; Dynamin, GTPase domain; Pleckstrin homology domain; Dynamin GTPase effector; PH-like domain superfamily; Dynamin, GTPase region, conserved site; GTPase effector domain; Dynamin; P-loop containing nucleoside triphosphate hydrolase; Dynamin-type guanine nucleotide-binding (G) domain; Dynamin, N-terminal	Q93YQ1	Q9LV27
Q9LVI6	Q9LVI6_S331	1.135513707885262	0.3619564441107539	9.770172178121438	3.137155661574047	0.01085569087938895	0.04072994478797155	At_XVE_RAPTOR_suc_24h	At_XVE_LST8_suc_24h	R1067	AT3G17840	receptor-like kinase 902	cytosol; membrane; plasma membrane; plasmodesma	phosphorylation; protein phosphorylation	ATP binding; kinase activity; nucleotide binding; protein binding; protein kinase activity	receptor-like kinase 902 [Source:NCBI gene (formerly Entrezgene);Acc:821053]	Protein kinase domain; Leucine-rich repeat; Protein kinase-like domain superfamily; Leucine-rich repeat-containing N-terminal, plant-type; Protein kinase, ATP binding site; Leucine-rich repeat domain superfamily	Q93YQ1	Q9LV27
Q9M885	Q9M885_S121	2.942338617763897	0.11843236981860408	11.022785625318312	24.84404071513983	4.9782963128937113e-11	1.045442225707679e-9	At_XVE_RAPTOR_suc_24h	At_XVE_LST8_suc_24h	R1067	AT3G02560	F16B3.19;<br>F16B3_19	chloroplast; cytosol; cytosolic ribosome; cytosolic small ribosomal subunit; ribonucleoprotein complex; ribosome	translation	mRNA binding; structural constituent of ribosome	Ribosomal protein S7e family protein [Source:NCBI gene (formerly Entrezgene);Acc:821308]	Ribosomal protein S7e	Q93YQ1	Q9LV27
O23052	O23052_S567	4.63447780429333	0.323422192831698	8.287070307340775	14.329498429642438	3.881777012020671e-7	2.5082251462287416e-6	At_XVE_RAPTOR_suc_4h	At_XVE_LST8_suc_24h	R1067	AT1G05150	YUP8H12.24;<br>YUP8H12_24	endosome; extracellular region; Golgi apparatus; plasma membrane; plasmodesma; trans-Golgi network	NA	calcium ion binding; metal ion binding; protein binding	Calcium-binding tetratricopeptide family protein [Source:NCBI gene (formerly Entrezgene);Acc:839312]	EF-hand domain; Tetratricopeptide-like helical domain superfamily; EF-hand domain pair; Tetratricopeptide repeat	Q93YQ1	Q9LV27
P41376	P41376_T145	1.0269453915191689	0.27732793766932173	8.57864840613793	3.7030001382106352	0.00532334824202022	0.0229313462733179	At_XVE_RAPTOR_suc_4h	At_XVE_LST8_suc_24h	R1067	AT3G13920	eukaryotic translation initiation factor 4A1;<br>RH4;<br>TIF4A1	cytoplasm; cytoplasmic stress granule	cytoplasmic translational initiation; translation; translational initiation	ATP binding; ATP hydrolysis activity; helicase activity; hydrolase activity; nucleic acid binding; nucleotide binding; protein binding; RNA binding; RNA helicase activity; translation initiation factor activity	eukaryotic translation initiation factor 4A1 [Source:NCBI gene (formerly Entrezgene);Acc:820605]	ATP-dependent RNA helicase DEAD-box, conserved site; Helicase, C-terminal; DEAD/DEAH box helicase domain; Helicase superfamily 1/2, ATP-binding domain; RNA helicase, DEAD-box type, Q motif; P-loop containing nucleoside triphosphate hydrolase	Q93YQ1	Q9LV27
P93004	P93004_S273	1.6823416535544349	0.22908815917223715	8.898210210382235	7.343642987194229	4.626881366220186e-5	2.5074711920161007e-4	At_XVE_RAPTOR_suc_4h	At_XVE_LST8_suc_24h	R1067	AT4G35100	PIP2;7;<br>PIP3A;<br>PLASMA MEMBRANE INTRINSIC PROTEIN 2;7;<br>PLASMA MEMBRANE INTRINSIC PROTEIN 3;<br>PLASMA MEMBRANE INTRINSIC PROTEIN 3A;<br>SIMIP;<br>T12J5.9	membrane; plasma membrane; plasmodesma; vacuole	transmembrane transport; water transport	channel activity; mRNA binding; protein binding; water channel activity	plasma membrane intrinsic protein 3 [Source:NCBI gene (formerly Entrezgene);Acc:829662]	Major intrinsic protein; Major intrinsic protein, conserved site; Aquaporin-like; Aquaporin transporter	Q93YQ1	Q9LV27
Q56Z59	Q56Z59_S108	5.025181682777872	0.20120847069490863	11.218115754168034	24.975000632043617	3.458256225148929e-11	9.683117430417e-10	At_XVE_RAPTOR_suc_4h	At_XVE_LST8_suc_24h	R1067	AT1G72160	T9N14.8;<br>T9N14_8	cytoplasm; membrane; plasma membrane	cell cycle; cell division	lipid binding	Sec14p-like phosphatidylinositol transfer family protein [Source:NCBI gene (formerly Entrezgene);Acc:843547]	CRAL-TRIO lipid binding domain; GOLD domain; CRAL/TRIO, N-terminal domain; CRAL/TRIO, N-terminal domain superfamily; GOLD domain superfamily; CRAL-TRIO lipid binding domain superfamily; Patellin	Q93YQ1	Q9LV27
Q8H1Y0	Q8H1Y0_S296	1.1265545969392194	0.2265381293146927	12.09932706502514	4.972913832859809	3.1579446066000975e-4	0.00165792091846505	At_XVE_RAPTOR_suc_4h	At_XVE_LST8_suc_24h	R1067	AT1G24180	F3I6.11;<br>F3I6_11;<br>IAA-CONJUGATE-RESISTANT 4	cytosol; intracellular membrane-bounded organelle; mitochondrial matrix; mitochondrion; nucleus	acetyl-CoA biosynthetic process from pyruvate; glycolytic process	cobalt ion binding; oxidoreductase activity; oxidoreductase activity, acting on the aldehyde or oxo group of donors, disulfide as acceptor; pyruvate dehydrogenase (acetyl-transferring) activity; zinc ion binding	Thiamin diphosphate-binding fold (THDP-binding) superfamily protein [Source:NCBI gene (formerly Entrezgene);Acc:839031]	Dehydrogenase, E1 component; Pyruvate dehydrogenase (acetyl-transferring) E1 component, alpha subunit, subgroup y; Thiamin diphosphate-binding fold	Q93YQ1	Q9LV27
Q8L5Y9	Q8L5Y9_S46	6.957236887492397	0.3591302920942461	8.722654965132302	19.372459078630488	1.7969513240350742e-8	1.8867988902368276e-7	At_XVE_RAPTOR_suc_4h	At_XVE_LST8_suc_24h	R1067	AT4G32180	ATPANK2;<br>F10M6.180;<br>F10M6_180;<br>pantothenate kinase 2	NA	coenzyme A biosynthetic process; phosphorylation	ATP binding; hydrolase activity; kinase activity; metal ion binding; nucleotide binding; pantothenate kinase activity; protein binding; transferase activity	pantothenate kinase 2 [Source:NCBI gene (formerly Entrezgene);Acc:829351]	Damage-control phosphatase ARMT1-like, metal-binding domain; Type II pantothenate kinase; Pantothenate kinase, acetyl-CoA regulated, two-domain type; At2g17340, three-helix bundle domain; AF1104-like superfamily; ATPase, nucleotide binding domain	Q93YQ1	Q9LV27
Q8LE63	Q8LE63_T232	4.026230437919346	0.33732679203823845	9.635965429180468	11.935697172440852	4.3394553795357466e-7	2.700105569488909e-6	At_XVE_RAPTOR_suc_4h	At_XVE_LST8_suc_24h	R1067	AT4G11860	T26M18.70<br>T26M18_70	cytosol	NA	cysteine-type deubiquitinase activity; K48-linked deubiquitinase activity	FAM63A-like protein (DUF544) [Source:NCBI gene (formerly Entrezgene);Acc:826793]	MINDY deubiquitinase; MINDY deubiquitinase domain	Q93YQ1	Q9LV27
Q9C514	Q9C514_S121	1.9844849233440685	0.13999245525757603	8.708611562174084	14.175656250136903	2.577804607538532e-7	1.8829181481151016e-6	At_XVE_RAPTOR_suc_4h	At_XVE_LST8_suc_24h	R1067	AT1G48830	F11I4.1;<br>F11I4_1	cytosolic ribosome; cytosolic small ribosomal subunit; nucleus; plant-type cell wall; polysomal ribosome; ribonucleoprotein complex; ribosome	translation	mRNA binding; structural constituent of ribosome	Ribosomal protein S7e family protein [Source:NCBI gene (formerly Entrezgene);Acc:841305]	Ribosomal protein S7e	Q93YQ1	Q9LV27
Q9C9Z6	Q9C9Z6_S218	5.765750540585665	0.1852983201220433	7.429388196811753	31.11604323659362	3.839118565810539e-9	5.3747659921347555e-8	At_XVE_RAPTOR_suc_4h	At_XVE_LST8_suc_24h	R1067	AT3G08600	NA	cytosol; membrane; plasma membrane	NA	molecular_function	transmembrane protein, putative (DUF1191) [Source:NCBI gene (formerly Entrezgene);Acc:820007]	Protein of unknown function DUF1191	Q93YQ1	Q9LV27
Q9FRL5	Q9FRL5_T304	5.503375183561372	0.4551159819130712	9.982355241124722	12.092247695692954	2.7643338753398413e-7	1.886637334116702e-6	At_XVE_RAPTOR_suc_4h	At_XVE_LST8_suc_24h	R1067	AT1G75240	AtHB33;<br>F22H5.4;<br>F22H5_4;<br>homeobox protein 33;<br>ZHD5;<br>zinc-finger homeodomain 5	nucleus	abscisic acid-activated signaling pathway; positive regulation of DNA-templated transcription; response to abscisic acid	DNA binding; DNA-binding transcription factor activity; metal ion binding; protein binding; protein homodimerization activity; sequence-specific DNA binding; transcription cis-regulatory region binding	homeobox protein 33 [Source:NCBI gene (formerly Entrezgene);Acc:843861]	Homeodomain, ZF-HD class; ZF-HD homeobox protein, Cys/His-rich dimerisation domain; Homeobox-like domain superfamily	Q93YQ1	Q9LV27
Q9LE80	Q9LE80_S218	5.02897579936561	0.3205844711896629	10.257049666267935	15.686897686289951	1.6775548685987833e-8	1.8788614528306368e-7	At_XVE_RAPTOR_suc_4h	At_XVE_LST8_suc_24h	R1067	AT3G15450	NA	NA	NA	protein binding	aluminum induced protein with YGL and LRDR motifs [Source:NCBI gene (formerly Entrezgene);Acc:820784]	Domain of unknown function DUF3700; Nucleophile aminohydrolases, N-terminal; Stem-specific protein TSJT1-like	Q93YQ1	Q9LV27
Q9LQ55	Q9LQ55_S823	6.699030861459596	0.20887245493088555	10.371937537075718	32.07235182674642	1.0221399245971716e-11	3.4343901466464967e-10	At_XVE_RAPTOR_suc_4h	At_XVE_LST8_suc_24h	R1067	AT1G59610	ADL3;<br>CF1;<br>DRP2B;<br>Dynamin related protein 2B;<br>DYNAMIN-LIKE 3;<br>T30E16.17;<br>T30E16_17	cell plate; clathrin-coated endocytic vesicle; clathrin-coated vesicle; cytoplasm; cytoplasmic vesicle; cytoskeleton; cytosol; intracellular organelle; membrane; microtubule; nucleus; plant-type vacuole; plasma membrane; plasmodesma	clathrin-dependent endocytosis; regulation of establishment of cell polarity; root hair initiation	clathrin binding; GTP binding; GTPase activity; hydrolase activity; nucleotide binding; protein binding	dynamin-like 3 [Source:NCBI gene (formerly Entrezgene);Acc:842251]	Dynamin stalk domain; Dynamin, GTPase domain; Pleckstrin homology domain; Dynamin GTPase effector; PH-like domain superfamily; Dynamin, GTPase region, conserved site; GTPase effector domain; Dynamin; P-loop containing nucleoside triphosphate hydrolase; Dynamin-type guanine nucleotide-binding (G) domain; Dynamin, N-terminal	Q93YQ1	Q9LV27
F4I0K2	F4I0K2_S131	3.8298471764267306	0.4266917114711305	9.2838550076584	8.975677458609022	7.07704926328831e-6	3.396983646378389e-5	At_XVE_RAPTOR_suc_24h	At_XVE_LST8_suc_4h	R1067	AT1G69200	F4N2.16;<br>F4N2_16;<br>fructokinase-like 2	chloroplast; chloroplast nucleoid; plastid; plastid-encoded plastid RNA polymerase complex	chloroplast organization; etioplast organization; phosphorylation; plastid transcription; regulation of DNA-templated transcription	kinase activity; protein binding; transferase activity	fructokinase-like protein [Source:NCBI gene (formerly Entrezgene);Acc:843251]	Carbohydrate kinase PfkB; Ribokinase-like	Q93YQ1	Q9LV27
O23052	O23052_S567	1.764963285197318	0.30019217736864734	8.287070307340775	5.8794446299973915	3.23464420476983e-4	0.00139338519590084	At_XVE_RAPTOR_suc_24h	At_XVE_LST8_suc_4h	R1067	AT1G05150	YUP8H12.24;<br>YUP8H12_24	endosome; extracellular region; Golgi apparatus; plasma membrane; plasmodesma; trans-Golgi network	NA	calcium ion binding; metal ion binding; protein binding	Calcium-binding tetratricopeptide family protein [Source:NCBI gene (formerly Entrezgene);Acc:839312]	EF-hand domain; Tetratricopeptide-like helical domain superfamily; EF-hand domain pair; Tetratricopeptide repeat	Q93YQ1	Q9LV27
O48549	O48549_T249	5.110622124174189	0.21992674251983416	9.107775637079664	23.23783849848677	2.0243430939343166e-9	2.8340803315080433e-8	At_XVE_RAPTOR_suc_24h	At_XVE_LST8_suc_4h	R1067	AT4G31700	AtRPS6;<br>F28M20.110;<br>F28M20_110;<br>RIBOSOMAL PROTEIN S6;<br>RPS6A	cytosolic ribosome; cytosolic small ribosomal subunit; nucleolus; plasma membrane; plasmodesma; polysomal ribosome; ribonucleoprotein complex; ribosome	translation	mRNA binding; structural constituent of ribosome	ribosomal protein S6 [Source:NCBI gene (formerly Entrezgene);Acc:829298]	Ribosomal protein S6e; Ribosomal protein S6, eukaryotic	Q93YQ1	Q9LV27
O48963	O48963_S350	4.4767036780403435	0.2656637993546117	9.643446770023004	16.851011274083216	1.7841711315332538e-8	1.7631808829269806e-7	At_XVE_RAPTOR_suc_24h	At_XVE_LST8_suc_4h	R1067	AT3G45780	F16L2.3;<br>JK224;<br>NONPHOTOTROPIC HYPOCOTYL 1;<br>NPH1;<br>PHOTOTROPIN;<br>phototropin 1;<br>ROOT PHOTOTROPISM 1;<br>RPT1	cell surface; cytoplasm; cytoplasmic side of plasma membrane; membrane; plant-type vacuole; plasma membrane	blue light signaling pathway; cellular response to blue light; chloroplast accumulation movement; chloroplast avoidance movement; circadian rhythm; negative regulation of anion channel activity by blue light; phosphorylation; phototropism; protein autophosphorylation; protein phosphorylation; regulation of proton transport; regulation of stomatal movement; response to blue light; response to stimulus	ATP binding; blue light photoreceptor activity; FMN binding; identical protein binding; kinase activity; mRNA binding; nucleotide binding; photoreceptor activity; protein binding; protein kinase activity; protein serine kinase activity; protein serine/threonine kinase activity; transferase activity	phototropin 1 [Source:NCBI gene (formerly Entrezgene);Acc:823721]	PAS domain; PAS-associated, C-terminal; Protein kinase domain; PAC motif; Serine/threonine-protein kinase, active site; Protein kinase-like domain superfamily; Protein kinase, ATP binding site; PAS domain superfamily	Q93YQ1	Q9LV27
P19456	P19456_T947	4.849273056270481	0.20161380820809324	11.256373100532976	24.052286395311587	4.9398013168450655e-11	1.65094741545174e-9	At_XVE_RAPTOR_suc_24h	At_XVE_LST8_suc_4h	R1067	AT4G30190	AHA2;<br>F9N11.40;<br>F9N11_40;<br>H(+)-ATPase 2;<br>P-TYPE H(+)-ATPASE ISOFORM 2;<br>PLASMA MEMBRANE PROTON ATPASE 2;<br>PMA2	membrane; plasma membrane	monoatomic ion transport; proton export across plasma membrane; proton transmembrane transport; regulation of intracellular pH	ATP binding; ATP hydrolysis activity; magnesium ion binding; metal ion binding; nucleotide binding; P-type proton-exporting transporter activity; protein binding; transporter activity	H[+]-ATPase 2 [Source:NCBI gene (formerly Entrezgene);Acc:829142]	P-type ATPase; Cation-transporting P-type ATPase, N-terminal; P-type ATPase, subfamily IIIA; P-type ATPase, A domain superfamily; P-type ATPase, phosphorylation site; HAD superfamily; P-type ATPase, transmembrane domain superfamily; P-type ATPase, cytoplasmic domain N; HAD-like superfamily; P-type ATPase, haloacid dehalogenase domain	Q93YQ1	Q9LV27
P43286	P43286_S280	1.8385783308444092	0.6069772434400382	11.300850400890797	3.0290729194792916	0.01114998137635216	0.03985525257930134	At_XVE_RAPTOR_suc_24h	At_XVE_LST8_suc_4h	R1067	AT3G53420	AtPIP2;1;<br>PIP2;<br>PIP2;1;<br>PLASMA MEMBRANE INTRINSIC PROTEIN 2;<br>PLASMA MEMBRANE INTRINSIC PROTEIN 2;1;<br>plasma membrane intrinsic protein 2A	membrane; plant-type vacuole; plasma membrane; plasmodesma	hydrogen peroxide transmembrane transport; response to water deprivation; transmembrane transport; water transport	channel activity; mRNA binding; ubiquitin protein ligase binding; water channel activity	plasma membrane intrinsic protein 2A [Source:NCBI gene (formerly Entrezgene);Acc:824510]	Major intrinsic protein; Major intrinsic protein, conserved site; Aquaporin-like; Aquaporin transporter	Q93YQ1	Q9LV27
P43286	P43286_S283	1.883416615124644	0.5888793243483662	11.084422886780189	3.198306575305167	0.008403314818572	0.03069036716348036	At_XVE_RAPTOR_suc_24h	At_XVE_LST8_suc_4h	R1067	AT3G53420	AtPIP2;1;<br>PIP2;<br>PIP2;1;<br>PLASMA MEMBRANE INTRINSIC PROTEIN 2;<br>PLASMA MEMBRANE INTRINSIC PROTEIN 2;1;<br>plasma membrane intrinsic protein 2A	membrane; plant-type vacuole; plasma membrane; plasmodesma	hydrogen peroxide transmembrane transport; response to water deprivation; transmembrane transport; water transport	channel activity; mRNA binding; ubiquitin protein ligase binding; water channel activity	plasma membrane intrinsic protein 2A [Source:NCBI gene (formerly Entrezgene);Acc:824510]	Major intrinsic protein; Major intrinsic protein, conserved site; Aquaporin-like; Aquaporin transporter	Q93YQ1	Q9LV27
P51430	P51430_S237	6.871660243623982	0.861371327551223	9.98496221921584	7.977581820791853	1.2178592698191635e-5	5.683343259156097e-5	At_XVE_RAPTOR_suc_24h	At_XVE_LST8_suc_4h	R1067	AT5G10360	embryo defective 3010;<br>F12B17.290;<br>F12B17_290;<br>Ribosomal protein small subunit 6b;<br>RPS6B	cellular anatomical entity; cytosolic ribosome; cytosolic small ribosomal subunit; plasma membrane; plasmodesma; polysomal ribosome; ribonucleoprotein complex; ribosome	translation	mRNA binding; structural constituent of ribosome	Ribosomal protein S6e [Source:NCBI gene (formerly Entrezgene);Acc:830900]	Ribosomal protein S6e; Ribosomal protein S6, eukaryotic; Ribosomal protein S6/S6e/A/B/2, conserved site	Q93YQ1	Q9LV27
Q56WH4	Q56WH4_S266	5.070412372401333	0.4312072818789218	9.488339422985836	11.75864273513138	5.715655404757341e-7	3.0975164774168816e-6	At_XVE_RAPTOR_suc_24h	At_XVE_LST8_suc_4h	R1067	AT5G22650	ARABIDOPSIS HISTONE DEACETYLASE 2;<br>ATHD2;<br>ATHD2B;<br>HD2;<br>HDA4;<br>HDT02;<br>HDT2;<br>HISTONE DEACETYLASE;<br>HISTONE DEACETYLASE 2;<br>histone deacetylase 2B;<br>MDJ22.7;<br>MDJ22_7	mitochondrion; nucleolus; nucleus; plant-type cell wall; plant-type vacuole; plastid	chromatin organization; chromatin remodeling; DNA-mediated transformation; negative regulation of DNA-templated transcription; polarity specification of adaxial/abaxial axis; root development; seed dormancy process	histone deacetylase activity; hydrolase activity; protein binding	histone deacetylase 2B [Source:NCBI gene (formerly Entrezgene);Acc:832328]	Nucleoplasmin-like domain	Q93YQ1	Q9LV27
Q84R17	Q84R17_S44	4.0746861683985465	0.18535275218922131	10.267777330321229	21.983413357891855	5.689292392108643e-10	1.0620012465269466e-8	At_XVE_RAPTOR_suc_24h	At_XVE_LST8_suc_4h	R1067	AT4G24275	NA	NA	response to water deprivation	NA	NA	NA	Q93YQ1	Q9LV27
Q8L7W3	Q8L7W3_S444	4.6435085306210215	0.3184340501247976	9.581146138420689	14.58232412269097	7.360028095807373e-8	5.888022476645899e-7	At_XVE_RAPTOR_suc_24h	At_XVE_LST8_suc_4h	R1067	AT2G29210	F16P2.41<br>F16P2_41	nucleus	mRNA processing; RNA splicing	protein binding	splicing factor PWI domain-containing protein [Source:NCBI gene (formerly Entrezgene);Acc:817470]	PWI domain; PWI domain superfamily	Q93YQ1	Q9LV27
Q8LE63	Q8LE63_T232	5.018486680975405	0.36664928712721456	9.635965429180468	13.687430624225282	1.2405640044429885e-7	9.473397852110096e-7	At_XVE_RAPTOR_suc_24h	At_XVE_LST8_suc_4h	R1067	AT4G11860	T26M18.70<br>T26M18_70	cytosol	NA	cysteine-type deubiquitinase activity; K48-linked deubiquitinase activity	FAM63A-like protein (DUF544) [Source:NCBI gene (formerly Entrezgene);Acc:826793]	MINDY deubiquitinase; MINDY deubiquitinase domain	Q93YQ1	Q9LV27
Q8LEQ0	Q8LEQ0_S103	5.059658105046587	0.4124820811588664	9.606073901469005	12.266370676834017	3.485653878108768e-7	2.168851301934344e-6	At_XVE_RAPTOR_suc_24h	At_XVE_LST8_suc_4h	R1067	AT5G47700	MCA23.2;<br>MCA23_2	cytoplasm; cytosolic ribosome; nucleoplasm; plastid; ribonucleoprotein complex; ribosome	translational elongation	protein binding; structural constituent of ribosome	60S acidic ribosomal protein family [Source:NCBI gene (formerly Entrezgene);Acc:834821]	Ribosomal protein L12/P1/P2 family; Ribosomal protein P1/P2, N-terminal domain	Q93YQ1	Q9LV27
Q93YQ1	Q93YQ1_S916	6.3813144895668605	0.1517439883421669	8.999063021588105	42.05316177124369	1.2149492679260308e-11	5.102786925289329e-10	At_XVE_RAPTOR_suc_24h	At_XVE_LST8_suc_4h	R1067	AT3G08850	ATRAPTOR1B;<br>RAPTOR1B	Cul4-RING E3 ubiquitin ligase complex; cytoplasm; TORC1 complex	embryo development ending in seed dormancy; maintenance of shoot apical meristem identity; negative regulation of autophagy; TOR signaling	kinase binding; protein binding	Regulatory-associated protein of TOR 1 [Source:NCBI gene (formerly Entrezgene);Acc:820032]	WD40 repeat; Regulatory associated protein of TOR; Armadillo-like helical; WD40/YVTN repeat-like-containing domain superfamily; Armadillo-type fold; Raptor, N-terminal CASPase-like domain; WD40-repeat-containing domain superfamily	Q93YQ1	Q9LV27
Q9C9Z6	Q9C9Z6_S218	8.045519394029995	0.24245102950809683	7.429388196811753	33.18410076605308	2.387476594055272e-9	2.9841097050478945e-8	At_XVE_RAPTOR_suc_24h	At_XVE_LST8_suc_4h	R1067	AT3G08600	NA	cytosol; membrane; plasma membrane	NA	molecular_function	transmembrane protein, putative (DUF1191) [Source:NCBI gene (formerly Entrezgene);Acc:820007]	Protein of unknown function DUF1191	Q93YQ1	Q9LV27
Q9LD43	Q9LD43_S741	2.735481613471544	0.20830207525771277	10.86329116861658	13.132282096024186	5.2379128013607634e-8	4.631417634887412e-7	At_XVE_RAPTOR_suc_24h	At_XVE_LST8_suc_4h	R1067	AT2G38040	acetyl Co-enzyme a carboxylase carboxyltransferase alpha subunit;<br>CARBOXYLTRANSFERASE ALPHA SUBUNIT;<br>T8P21.5;<br>T8P21_5	acetyl-CoA carboxylase complex; chloroplast; chloroplast envelope; chloroplast inner membrane; chloroplast stroma; endoplasmic reticulum; membrane; plastid; plastid inner membrane	fatty acid biosynthetic process; fatty acid metabolic process; lipid metabolic process; malonyl-CoA biosynthetic process	acetyl-CoA carboxylase activity; ATP binding; carboxyl- or carbamoyltransferase activity; ligase activity; nucleotide binding; transferase activity	acetyl Co-enzyme a carboxylase carboxyltransferase alpha subunit [Source:NCBI gene (formerly Entrezgene);Acc:818382]	Acetyl-CoA carboxylase, alpha subunit; Acetyl-coenzyme A carboxyltransferase, C-terminal; ClpP/crotonase-like domain superfamily	Q93YQ1	Q9LV27
Q9LJX0	Q9LJX0_S647	4.838081605140547	0.3889880437010292	8.756095048788065	12.43761005893289	7.299260018428122e-7	3.832111509674764e-6	At_XVE_RAPTOR_suc_24h	At_XVE_LST8_suc_4h	R1067	AT3G28860	Arabidopsis thaliana ATP-binding cassette B19;<br>ATABCB19;<br>ATMDR1;<br>ATMDR11;<br>ATP BINDING CASSETTE SUBFAMILY B19;<br>ATP-binding cassette B19;<br>ATPGP19;<br>MDR1;<br>MDR11;<br>MULTIDRUG RESISTANCE PROTEIN 11;<br>P-GLYCOPROTEIN 19;<br>PGP19	cytosol; membrane; plasma membrane	acropetal auxin transport; anthocyanin accumulation in tissues in response to UV light; auxin export across the plasma membrane; auxin polar transport; auxin transport; auxin-activated signaling pathway; basipetal auxin transport; formation of plant organ boundary; lateral root development; photomorphogenesis; positive gravitropism; regulation of cell size; response to auxin; response to blue light; response to far red light; response to red or far red light; root development; stamen development; transmembrane transport	ABC-type transporter activity; ATP binding; ATP hydrolysis activity; auxin efflux transmembrane transporter activity; nucleotide binding; protein binding	ATP binding cassette subfamily B19 [Source:NCBI gene (formerly Entrezgene);Acc:822519]	ABC transporter-like, ATP-binding domain; AAA+ ATPase domain; ABC transporter type 1, transmembrane domain; ABC transporter-like, conserved site; P-loop containing nucleoside triphosphate hydrolase; ABC transporter type 1, transmembrane domain superfamily; Type 1 protein exporter	Q93YQ1	Q9LV27
