protein	Index	logFC	se	df	t	pval	adjPval	group1	group2	batch	gene	Synonyms	GO cellular component	GO biological process	GO molecular function	Description	Interpro terms	bait	control
P43286	P43286_S283	2.353759806396994	0.5670094991473016	11.084422886780189	-4.1511823169394875	0.00158735651066257	0.006201764971891	At_XVE_GFP_suc_4h	At_XVE_RAPTOR_suc_24h	R1067	AT3G53420	AtPIP2;1;<br>PIP2;<br>PIP2;1;<br>PLASMA MEMBRANE INTRINSIC PROTEIN 2;<br>PLASMA MEMBRANE INTRINSIC PROTEIN 2;1;<br>plasma membrane intrinsic protein 2A	membrane; plant-type vacuole; plasma membrane; plasmodesma	hydrogen peroxide transmembrane transport; response to water deprivation; transmembrane transport; water transport	channel activity; mRNA binding; ubiquitin protein ligase binding; water channel activity	plasma membrane intrinsic protein 2A [Source:NCBI gene (formerly Entrezgene);Acc:824510]	Major intrinsic protein; Major intrinsic protein, conserved site; Aquaporin-like; Aquaporin transporter	GFP	Q93YQ1
PafA	PafA_T285	9.561995003670498	0.3027655475559564	9.009226293851688	-31.5821766408322	1.5426242899939483e-10	2.879565341322037e-9	At_XVE_GFP_suc_4h	At_XVE_RAPTOR_suc_24h	R1067	NA	NA	NA	NA	NA	NA	NA	GFP	Q93YQ1
PafA	PafA_T286	9.560368789417156	0.32718140638415	9.04535817451001	-29.220391510244145	2.889838827974156e-10	4.854929230996582e-9	At_XVE_GFP_suc_4h	At_XVE_RAPTOR_suc_24h	R1067	NA	NA	NA	NA	NA	NA	NA	GFP	Q93YQ1
Q96327	Q96327_S2	2.583991781331096	0.6515516040081337	11.265072586701164	-3.965905026455646	0.00211272338573569	0.00788750064007993	At_XVE_GFP_suc_4h	At_XVE_RAPTOR_suc_24h	R1067	AT3G51800	A. THALIANA ERBB-3 BINDING PROTEIN 1;<br>ATEBP1;<br>EBP1;<br>ERBB-3 BINDING PROTEIN 1	cytosol; nucleolus; nucleus; ribonucleoprotein complex	auxin-activated signaling pathway; cell cycle G1/S phase transition; regulation of cell division; regulation of cell growth; rRNA processing	mRNA binding; protein binding; RNA binding	metallopeptidase M24 family protein [Source:NCBI gene (formerly Entrezgene);Acc:824343]	Peptidase M24; Peptidase M24, methionine aminopeptidase; PA2G4 family; Creatinase/aminopeptidase-like; Winged helix-like DNA-binding domain superfamily; Winged helix DNA-binding domain superfamily; Proliferation-associated protein 2G4/ARX1	GFP	Q93YQ1
Q96327	Q96327_S3	6.9136063115976985	0.1824949998630912	10.44951397083608	-37.88381225120867	1.5751918762003576e-12	2.1380949249035748e-10	At_XVE_GFP_suc_4h	At_XVE_RAPTOR_suc_24h	R1067	AT3G51800	A. THALIANA ERBB-3 BINDING PROTEIN 1;<br>ATEBP1;<br>EBP1;<br>ERBB-3 BINDING PROTEIN 1	cytosol; nucleolus; nucleus; ribonucleoprotein complex	auxin-activated signaling pathway; cell cycle G1/S phase transition; regulation of cell division; regulation of cell growth; rRNA processing	mRNA binding; protein binding; RNA binding	metallopeptidase M24 family protein [Source:NCBI gene (formerly Entrezgene);Acc:824343]	Peptidase M24; Peptidase M24, methionine aminopeptidase; PA2G4 family; Creatinase/aminopeptidase-like; Winged helix-like DNA-binding domain superfamily; Winged helix DNA-binding domain superfamily; Proliferation-associated protein 2G4/ARX1	GFP	Q93YQ1
Q9C9W5	Q9C9W5_S365	3.1487793114732976	0.8832979572295598	10.652461725726807	-3.564798588858236	0.00465934932234052	0.01665469545006825	At_XVE_GFP_suc_4h	At_XVE_RAPTOR_suc_24h	R1067	AT1G68010	ATHPR1;<br>hydroxypyruvate reductase	apoplast; chloroplast; cytosol; mitochondrion; peroxisome	cellular response to light stimulus; cellular response to water deprivation; oxidative photosynthetic carbon pathway; photorespiration	glycerate dehydrogenase activity; mRNA binding; NAD binding; oxidoreductase activity; oxidoreductase activity, acting on the CH-OH group of donors, NAD or NADP as acceptor; poly(U) RNA binding	hydroxypyruvate reductase [Source:NCBI gene (formerly Entrezgene);Acc:843129]	D-isomer specific 2-hydroxyacid dehydrogenase, catalytic domain; D-isomer specific 2-hydroxyacid dehydrogenase, NAD-binding domain; D-isomer specific 2-hydroxyacid dehydrogenase, NAD-binding domain conserved site 1; NAD(P)-binding domain superfamily	GFP	Q93YQ1
Q9FKA5	Q9FKA5_S339	3.4840533472095037	0.30286193392081057	11.185124653936628	-11.503767746924844	1.5299903297620017e-7	9.519939829630232e-7	At_XVE_GFP_suc_4h	At_XVE_RAPTOR_suc_24h	R1067	NA	NA	NA	NA	NA	NA	NA	GFP	Q93YQ1
Q9LF98	Q9LF98_S350	3.699615829094847	0.5163857767877784	10.503688507071818	-7.164441770857094	2.350814605555507e-5	1.06739690198196e-4	At_XVE_GFP_suc_4h	At_XVE_RAPTOR_suc_24h	R1067	AT3G52930	AtFBA8;<br>fructose-bisphosphate aldolase 8	apoplast; chloroplast; cytoplasm; cytosol; membrane; mitochondrial envelope; mitochondrial outer membrane; mitochondrion; nucleolus; plant-type cell wall; plant-type vacuole; plasma membrane; plasmodesma	gluconeogenesis; glycolytic process	copper ion binding; fructose-bisphosphate aldolase activity; lyase activity; mRNA binding; protein binding	Aldolase superfamily protein [Source:NCBI gene (formerly Entrezgene);Acc:824459]	Fructose-bisphosphate aldolase, class-I; Aldolase-type TIM barrel; Fructose-bisphosphate aldolase class-I active site	GFP	Q93YQ1
NA	FLAG-PUP_Y3	3.498262392198487	0.22499576762043397	9.646514929608776	-15.548125323406206	3.766241860075051e-8	3.721933132309463e-7	At_XVE_GFP_suc_4h	At_XVE_RAPTOR_suc_4h	R1067	NA	NA	NA	NA	NA	NA	NA	GFP	Q93YQ1
O23404	O23404_T543	2.149593860421855	0.20793768687231312	11.62294387308382	-10.3376828546806	3.302622912894176e-7	2.4123506494183547e-6	At_XVE_GFP_suc_4h	At_XVE_RAPTOR_suc_4h	R1067	AT4G15530	DL3805C;<br>FCAALL.325;<br>pyruvate orthophosphate dikinase	chloroplast; chloroplast stroma; cytoplasm; cytosol; plastid	phosphorylation; photosynthesis; pyruvate metabolic process	ATP binding; catalytic activity; kinase activity; metal ion binding; nucleotide binding; pyruvate, phosphate dikinase activity; transferase activity; transferase activity, transferring phosphorus-containing groups	pyruvate orthophosphate dikinase [Source:NCBI gene (formerly Entrezgene);Acc:827226]	PEP-utilising enzyme, C-terminal; Pyruvate phosphate dikinase, AMP/ATP-binding; PEP-utilising enzyme, mobile domain; Pyruvate, phosphate dikinase; ATP-grasp fold, subdomain 1; Pyruvate/Phosphoenolpyruvate kinase-like domain superfamily; PEP-utilising enzyme, active site; PEP-utilising enzyme, conserved site; Phosphohistidine domain superfamily; Pyruvate kinase-like domain superfamily	GFP	Q93YQ1
P43286	P43286_S280	2.964720423491123	0.5732043213034492	11.300850400890797	-5.172187845251129	2.8186346391166346e-4	0.00124613320887261	At_XVE_GFP_suc_4h	At_XVE_RAPTOR_suc_4h	R1067	AT3G53420	AtPIP2;1;<br>PIP2;<br>PIP2;1;<br>PLASMA MEMBRANE INTRINSIC PROTEIN 2;<br>PLASMA MEMBRANE INTRINSIC PROTEIN 2;1;<br>plasma membrane intrinsic protein 2A	membrane; plant-type vacuole; plasma membrane; plasmodesma	hydrogen peroxide transmembrane transport; response to water deprivation; transmembrane transport; water transport	channel activity; mRNA binding; ubiquitin protein ligase binding; water channel activity	plasma membrane intrinsic protein 2A [Source:NCBI gene (formerly Entrezgene);Acc:824510]	Major intrinsic protein; Major intrinsic protein, conserved site; Aquaporin-like; Aquaporin transporter	GFP	Q93YQ1
P43286	P43286_S283	2.987150078924576	0.5543551077441962	11.084422886780189	-5.388513675070129	2.147209550363329e-4	9.74949201246052e-4	At_XVE_GFP_suc_4h	At_XVE_RAPTOR_suc_4h	R1067	AT3G53420	AtPIP2;1;<br>PIP2;<br>PIP2;1;<br>PLASMA MEMBRANE INTRINSIC PROTEIN 2;<br>PLASMA MEMBRANE INTRINSIC PROTEIN 2;1;<br>plasma membrane intrinsic protein 2A	membrane; plant-type vacuole; plasma membrane; plasmodesma	hydrogen peroxide transmembrane transport; response to water deprivation; transmembrane transport; water transport	channel activity; mRNA binding; ubiquitin protein ligase binding; water channel activity	plasma membrane intrinsic protein 2A [Source:NCBI gene (formerly Entrezgene);Acc:824510]	Major intrinsic protein; Major intrinsic protein, conserved site; Aquaporin-like; Aquaporin transporter	GFP	Q93YQ1
PafA	PafA_T285	9.579361198573556	0.3027655475559564	9.009226293851688	-31.639535197785744	1.5178129312970942e-10	5.12954122157297e-9	At_XVE_GFP_suc_4h	At_XVE_RAPTOR_suc_4h	R1067	NA	NA	NA	NA	NA	NA	NA	GFP	Q93YQ1
PafA	PafA_T286	9.615441598741231	0.32718140638414994	9.04535817451001	-29.388716507476467	2.7448783842759924e-10	7.685659475972778e-9	At_XVE_GFP_suc_4h	At_XVE_RAPTOR_suc_4h	R1067	NA	NA	NA	NA	NA	NA	NA	GFP	Q93YQ1
Q96327	Q96327_S3	6.9717474579250585	0.18249499986309117	10.44951397083608	-38.20240260366205	1.4440397289405697e-12	2.425986744620157e-10	At_XVE_GFP_suc_4h	At_XVE_RAPTOR_suc_4h	R1067	AT3G51800	A. THALIANA ERBB-3 BINDING PROTEIN 1;<br>ATEBP1;<br>EBP1;<br>ERBB-3 BINDING PROTEIN 1	cytosol; nucleolus; nucleus; ribonucleoprotein complex	auxin-activated signaling pathway; cell cycle G1/S phase transition; regulation of cell division; regulation of cell growth; rRNA processing	mRNA binding; protein binding; RNA binding	metallopeptidase M24 family protein [Source:NCBI gene (formerly Entrezgene);Acc:824343]	Peptidase M24; Peptidase M24, methionine aminopeptidase; PA2G4 family; Creatinase/aminopeptidase-like; Winged helix-like DNA-binding domain superfamily; Winged helix DNA-binding domain superfamily; Proliferation-associated protein 2G4/ARX1	GFP	Q93YQ1
Q9C9W5	Q9C9W5_S365	3.1468456119514983	0.8197908839461221	10.652461725726807	-3.838595516949312	0.0029171640276837	0.01166865611073482	At_XVE_GFP_suc_4h	At_XVE_RAPTOR_suc_4h	R1067	AT1G68010	ATHPR1;<br>hydroxypyruvate reductase	apoplast; chloroplast; cytosol; mitochondrion; peroxisome	cellular response to light stimulus; cellular response to water deprivation; oxidative photosynthetic carbon pathway; photorespiration	glycerate dehydrogenase activity; mRNA binding; NAD binding; oxidoreductase activity; oxidoreductase activity, acting on the CH-OH group of donors, NAD or NADP as acceptor; poly(U) RNA binding	hydroxypyruvate reductase [Source:NCBI gene (formerly Entrezgene);Acc:843129]	D-isomer specific 2-hydroxyacid dehydrogenase, catalytic domain; D-isomer specific 2-hydroxyacid dehydrogenase, NAD-binding domain; D-isomer specific 2-hydroxyacid dehydrogenase, NAD-binding domain conserved site 1; NAD(P)-binding domain superfamily	GFP	Q93YQ1
Q9C9Z6	Q9C9Z6_S218	2.130904676338925	0.2351799076616615	7.429388196811753	-9.060742890521595	2.82510833027764e-5	1.483181873395761e-4	At_XVE_GFP_suc_4h	At_XVE_RAPTOR_suc_4h	R1067	AT3G08600	NA	cytosol; membrane; plasma membrane	NA	molecular_function	transmembrane protein, putative (DUF1191) [Source:NCBI gene (formerly Entrezgene);Acc:820007]	Protein of unknown function DUF1191	GFP	Q93YQ1
Q9FKA5	Q9FKA5_S339	2.82965161101007	0.30286193392081057	11.185124653936628	-9.343041478926631	1.278483748737529e-6	7.955009992144625e-6	At_XVE_GFP_suc_4h	At_XVE_RAPTOR_suc_4h	R1067	NA	NA	NA	NA	NA	NA	NA	GFP	Q93YQ1
F4I0K2	F4I0K2_S131	3.9947531100046585	0.46220939216885853	9.2838550076584	-8.642734608355294	9.713707860737656e-6	7.095230089582286e-5	At_XVE_LST8_suc_24h	At_XVE_LST8_suc_4h	R1067	AT1G69200	F4N2.16;<br>F4N2_16;<br>fructokinase-like 2	chloroplast; chloroplast nucleoid; plastid; plastid-encoded plastid RNA polymerase complex	chloroplast organization; etioplast organization; phosphorylation; plastid transcription; regulation of DNA-templated transcription	kinase activity; protein binding; transferase activity	fructokinase-like protein [Source:NCBI gene (formerly Entrezgene);Acc:843251]	Carbohydrate kinase PfkB; Ribokinase-like	Q9LV27	Q9LV27
O48963	O48963_S350	5.2451900388203665	0.2665619274564229	9.643446770023004	-19.677191296112017	4.158320344449802e-9	8.732472723344585e-8	At_XVE_LST8_suc_24h	At_XVE_LST8_suc_4h	R1067	AT3G45780	F16L2.3;<br>JK224;<br>NONPHOTOTROPIC HYPOCOTYL 1;<br>NPH1;<br>PHOTOTROPIN;<br>phototropin 1;<br>ROOT PHOTOTROPISM 1;<br>RPT1	cell surface; cytoplasm; cytoplasmic side of plasma membrane; membrane; plant-type vacuole; plasma membrane	blue light signaling pathway; cellular response to blue light; chloroplast accumulation movement; chloroplast avoidance movement; circadian rhythm; negative regulation of anion channel activity by blue light; phosphorylation; phototropism; protein autophosphorylation; protein phosphorylation; regulation of proton transport; regulation of stomatal movement; response to blue light; response to stimulus	ATP binding; blue light photoreceptor activity; FMN binding; identical protein binding; kinase activity; mRNA binding; nucleotide binding; photoreceptor activity; protein binding; protein kinase activity; protein serine kinase activity; protein serine/threonine kinase activity; transferase activity	phototropin 1 [Source:NCBI gene (formerly Entrezgene);Acc:823721]	PAS domain; PAS-associated, C-terminal; Protein kinase domain; PAC motif; Serine/threonine-protein kinase, active site; Protein kinase-like domain superfamily; Protein kinase, ATP binding site; PAS domain superfamily	Q9LV27	Q9LV27
O49006	O49006_T173	2.5920169312655967	0.637250471443889	9.917392265522375	-4.067501002223783	0.00229812279870623	0.01206514469320771	At_XVE_LST8_suc_24h	At_XVE_LST8_suc_4h	R1067	AT3G14310	ATPME3;<br>OVERLY ZINC SENSITIVE 2;<br>OZS2;<br>pectin methylesterase 3	apoplast; cytoplasm; cytosol; extracellular region; plant-type cell wall	cell wall modification; cell wall organization; defense response; defense response to bacterium; defense response to fungus; defense response to Gram-negative bacterium; negative regulation of seed germination; pectin catabolic process; regulation of gene expression; regulation of unidimensional cell growth; response to bacterium; response to fungus; response to nematode; response to zinc ion; root development; root hair cell development	aspartyl esterase activity; enzyme inhibitor activity; hydrolase activity; mRNA binding; pectinesterase activity; protein binding	pectin methylesterase 3 [Source:NCBI gene (formerly Entrezgene);Acc:820651]	Pectinesterase, catalytic; Pectinesterase inhibitor domain; Pectin lyase fold/virulence factor; Pectin lyase fold; Pectinesterase, Tyr active site; Pectinesterase, Asp active site; Invertase/pectin methylesterase inhibitor domain superfamily	Q9LV27	Q9LV27
P51430	P51430_S237	7.360964720376047	0.9199652247490891	9.98496221921584	-8.001351053659308	1.1865835216660625e-5	8.306084651662437e-5	At_XVE_LST8_suc_24h	At_XVE_LST8_suc_4h	R1067	AT5G10360	embryo defective 3010;<br>F12B17.290;<br>F12B17_290;<br>Ribosomal protein small subunit 6b;<br>RPS6B	cellular anatomical entity; cytosolic ribosome; cytosolic small ribosomal subunit; plasma membrane; plasmodesma; polysomal ribosome; ribonucleoprotein complex; ribosome	translation	mRNA binding; structural constituent of ribosome	Ribosomal protein S6e [Source:NCBI gene (formerly Entrezgene);Acc:830900]	Ribosomal protein S6e; Ribosomal protein S6, eukaryotic; Ribosomal protein S6/S6e/A/B/2, conserved site	Q9LV27	Q9LV27
Q84R17	Q84R17_S44	5.303800732985809	0.18230503831240596	10.267777330321229	-29.093001389774987	3.3411948493423676e-11	1.4033018367237947e-9	At_XVE_LST8_suc_24h	At_XVE_LST8_suc_4h	R1067	AT4G24275	NA	NA	response to water deprivation	NA	NA	NA	Q9LV27	Q9LV27
Q8GUP3	Q8GUP3_T289	1.0358356998178362	0.17598338121323215	7.973108218001895	-5.8859858963770835	3.722695878567893e-4	0.00227530598332064	At_XVE_LST8_suc_24h	At_XVE_LST8_suc_4h	R1067	AT4G31880	F11C18.80;<br>F11C18_80	nucleus	cell cycle; cell division; cellular response to DNA damage stimulus; DNA recombination; DNA repair; homologous recombination; microsporogenesis; mitotic sister chromatid cohesion	molecular_function	transcriptional regulator [Source:NCBI gene (formerly Entrezgene);Acc:829318]	Armadillo-type fold; Sister chromatid cohesion protein Pds5	Q9LV27	Q9LV27
Q8H1Y0	Q8H1Y0_Y292	4.685571299690826	0.30751176322699325	9.500982581206705	-15.237047358842398	5.3980650462377994e-8	5.667968298549688e-7	At_XVE_LST8_suc_24h	At_XVE_LST8_suc_4h	R1067	AT1G24180	F3I6.11;<br>F3I6_11;<br>IAA-CONJUGATE-RESISTANT 4	cytosol; intracellular membrane-bounded organelle; mitochondrial matrix; mitochondrion; nucleus	acetyl-CoA biosynthetic process from pyruvate; glycolytic process	cobalt ion binding; oxidoreductase activity; oxidoreductase activity, acting on the aldehyde or oxo group of donors, disulfide as acceptor; pyruvate dehydrogenase (acetyl-transferring) activity; zinc ion binding	Thiamin diphosphate-binding fold (THDP-binding) superfamily protein [Source:NCBI gene (formerly Entrezgene);Acc:839031]	Dehydrogenase, E1 component; Pyruvate dehydrogenase (acetyl-transferring) E1 component, alpha subunit, subgroup y; Thiamin diphosphate-binding fold	Q9LV27	Q9LV27
Q8L7S4	Q8L7S4_S486	2.25202512746191	0.16134452332705845	10.08371449307335	-13.95786532460648	6.36912694644271e-8	6.294196041190442e-7	At_XVE_LST8_suc_24h	At_XVE_LST8_suc_4h	R1067	AT1G24764	ATMAP70-2;<br>F5A9.19;<br>F5A9_19;<br>microtubule-associated proteins 70-2	cytoplasm; cytoskeleton; microtubule	cytoskeleton organization	microtubule binding	microtubule-associated proteins 70-2 [Source:NCBI gene (formerly Entrezgene);Acc:839083]	Microtubule-associated protein 70	Q9LV27	Q9LV27
Q8L7W3	Q8L7W3_S444	5.345305795420061	0.3164373992811294	9.581146138420689	-16.892142988039108	1.8882224704581277e-8	2.440164423361273e-7	At_XVE_LST8_suc_24h	At_XVE_LST8_suc_4h	R1067	AT2G29210	F16P2.41<br>F16P2_41	nucleus	mRNA processing; RNA splicing	protein binding	splicing factor PWI domain-containing protein [Source:NCBI gene (formerly Entrezgene);Acc:817470]	PWI domain; PWI domain superfamily	Q9LV27	Q9LV27
Q8W4D8	Q8W4D8_S133	4.427862622207827	0.19335447328781313	11.178782036900254	-22.90023368436291	9.533565614674028e-11	3.203278046530474e-9	At_XVE_LST8_suc_24h	At_XVE_LST8_suc_4h	R1067	AT3G20550	DAWDLE	nucleus	cell division; miRNA processing; regulation of developmental growth; RNA-mediated gene silencing	protein binding; RNA binding	SMAD/FHA domain-containing protein [Source:NCBI gene (formerly Entrezgene);Acc:821601]	Forkhead-associated (FHA) domain; SMAD/FHA domain superfamily	Q9LV27	Q9LV27
Q93VG5	Q93VG5_Y84	5.152691188745792	0.6345033573173481	10.239334108184956	-8.12082572822174	8.90911846685516e-6	6.803326829234849e-5	At_XVE_LST8_suc_24h	At_XVE_LST8_suc_4h	R1067	AT5G20290	F5O24.180;<br>F5O24_180	chloroplast; cytosolic ribosome; cytosolic small ribosomal subunit; nucleolus; plant-type cell wall; plasmodesma; polysomal ribosome; ribonucleoprotein complex; ribosome	translation	mRNA binding; protein binding; structural constituent of ribosome	Ribosomal protein S8e family protein [Source:NCBI gene (formerly Entrezgene);Acc:832151]	Ribosomal protein S8e; Ribosomal protein S8e, conserved site; Ribosomal protein S8e/ribosomal biogenesis NSA2; Ribosomal protein S8e subdomain, eukaryotes	Q9LV27	Q9LV27
Q9FF53	Q9FF53_S283	4.293198534093705	0.21065955006385495	11.144006763207686	-20.379795422483117	3.5798902104587574e-10	1.0023692589284521e-8	At_XVE_LST8_suc_24h	At_XVE_LST8_suc_4h	R1067	AT5G60660	MUP24.9;<br>MUP24_9;<br>PIP2F;<br>plasma membrane intrinsic protein 2;4	membrane; plasma membrane; plasmodesma	hydrogen peroxide transmembrane transport; root hair elongation; transmembrane transport; water transport	channel activity; water channel activity	plasma membrane intrinsic protein 2;4 [Source:NCBI gene (formerly Entrezgene);Acc:836187]	Major intrinsic protein; Major intrinsic protein, conserved site; Aquaporin-like; Aquaporin transporter	Q9LV27	Q9LV27
Q9FF53	Q9FF53_S286	4.39111261264091	0.5122676444409111	9.51309542637333	-8.571910914719922	8.882333858825513e-6	6.803326829234849e-5	At_XVE_LST8_suc_24h	At_XVE_LST8_suc_4h	R1067	AT5G60660	MUP24.9;<br>MUP24_9;<br>PIP2F;<br>plasma membrane intrinsic protein 2;4	membrane; plasma membrane; plasmodesma	hydrogen peroxide transmembrane transport; root hair elongation; transmembrane transport; water transport	channel activity; water channel activity	plasma membrane intrinsic protein 2;4 [Source:NCBI gene (formerly Entrezgene);Acc:836187]	Major intrinsic protein; Major intrinsic protein, conserved site; Aquaporin-like; Aquaporin transporter	Q9LV27	Q9LV27
Q9FG81	Q9FG81_S243	1.407541843881263	0.2800638253807884	7.769297951919564	-5.02578953910774	0.00111340868412605	0.00623508863110592	At_XVE_LST8_suc_24h	At_XVE_LST8_suc_4h	R1067	AT5G43830	MQD19.19<br>MQD19_19	cytosol; plastid	biological_process	identical protein binding; protein binding	aluminum induced protein with YGL and LRDR motifs [Source:NCBI gene (formerly Entrezgene);Acc:834405]	Domain of unknown function DUF3700; Nucleophile aminohydrolases, N-terminal; Stem-specific protein TSJT1-like	Q9LV27	Q9LV27
Q9FMF5	Q9FMF5_S222	4.717367764494397	0.0760363044929038	12.306618116278663	-62.04099207549799	9.688831346799279e-17	8.138618331311394e-15	At_XVE_LST8_suc_24h	At_XVE_LST8_suc_4h	R1067	AT5G64330	JK218;<br>MSJ1.17;<br>MSJ1_17;<br>NON-PHOTOTROPIC HYPOCOTYL 3;<br>ROOT PHOTOTROPISM 3;<br>RPT3	membrane; plasma membrane	blue light signaling pathway; phototropism; protein ubiquitination; signal transduction	protein binding	Phototropic-responsive NPH3 family protein [Source:NCBI gene (formerly Entrezgene);Acc:836554]	BTB/POZ domain; SKP1/BTB/POZ domain superfamily; NPH3 domain; NPH3/RPT2-like family	Q9LV27	Q9LV27
Q9LF79	Q9LF79_S7	5.209923557345294	0.04622572701689678	9.379829669097443	-112.70614641584594	5.1940987383903845e-16	2.908695293498614e-14	At_XVE_LST8_suc_24h	At_XVE_LST8_suc_4h	R1067	AT5G57110	''AUTOINHIBITED CA2+ -ATPASE;<br>'autoinhibited Ca2+ -ATPase;<br>AT-ACA8;<br>AUTOINHIBITED CA2+ -ATPASE;<br>ISOFORM 8;<br>isoform 8';<br>ISOFORM 8'';<br>MUL3.5;<br>MUL3_5	cellular anatomical entity; membrane; plasma membrane; plasmodesma; plastid	calcium ion transmembrane transport; calcium ion transport; monoatomic ion transport; response to nematode	ATP binding; ATP hydrolysis activity; calmodulin binding; metal ion binding; nucleotide binding; P-type calcium transporter activity; protein binding; protein self-association; transporter activity	autoinhibited Ca2+ -ATPase [Source:NCBI gene (formerly Entrezgene);Acc:835815]	P-type ATPase; Cation-transporting P-type ATPase, N-terminal; Cation-transporting P-type ATPase, C-terminal; P-type ATPase, subfamily IIB; P-type ATPase, A domain superfamily; P-type ATPase, phosphorylation site; HAD superfamily; P-type ATPase, transmembrane domain superfamily; P-type ATPase, cytoplasmic domain N; Calcium-transporting P-type ATPase, N-terminal autoinhibitory domain; HAD-like superfamily; P-type ATPase, haloacid dehalogenase domain	Q9LV27	Q9LV27
Q9LQ55	Q9LQ55_S719	1.5953807792896797	0.21363093404582456	9.3380336005133735	-7.467929616164413	3.12496240393025e-5	2.0192064763857e-4	At_XVE_LST8_suc_24h	At_XVE_LST8_suc_4h	R1067	AT1G59610	ADL3;<br>CF1;<br>DRP2B;<br>Dynamin related protein 2B;<br>DYNAMIN-LIKE 3;<br>T30E16.17;<br>T30E16_17	cell plate; clathrin-coated endocytic vesicle; clathrin-coated vesicle; cytoplasm; cytoplasmic vesicle; cytoskeleton; cytosol; intracellular organelle; membrane; microtubule; nucleus; plant-type vacuole; plasma membrane; plasmodesma	clathrin-dependent endocytosis; regulation of establishment of cell polarity; root hair initiation	clathrin binding; GTP binding; GTPase activity; hydrolase activity; nucleotide binding; protein binding	dynamin-like 3 [Source:NCBI gene (formerly Entrezgene);Acc:842251]	Dynamin stalk domain; Dynamin, GTPase domain; Pleckstrin homology domain; Dynamin GTPase effector; PH-like domain superfamily; Dynamin, GTPase region, conserved site; GTPase effector domain; Dynamin; P-loop containing nucleoside triphosphate hydrolase; Dynamin-type guanine nucleotide-binding (G) domain; Dynamin, N-terminal	Q9LV27	Q9LV27
Q9LVI6	Q9LVI6_S331	4.690587215349511	0.3569480628174111	9.770172178121438	-13.140811518422158	1.5690668056336756e-7	1.464462351924764e-6	At_XVE_LST8_suc_24h	At_XVE_LST8_suc_4h	R1067	AT3G17840	receptor-like kinase 902	cytosol; membrane; plasma membrane; plasmodesma	phosphorylation; protein phosphorylation	ATP binding; kinase activity; nucleotide binding; protein binding; protein kinase activity	receptor-like kinase 902 [Source:NCBI gene (formerly Entrezgene);Acc:821053]	Protein kinase domain; Leucine-rich repeat; Protein kinase-like domain superfamily; Leucine-rich repeat-containing N-terminal, plant-type; Protein kinase, ATP binding site; Leucine-rich repeat domain superfamily	Q9LV27	Q9LV27
Q9M8T0	Q9M8T0_S621	1.5427272990615108	0.3043268893061262	10.299373652279414	-5.06930985487011	4.428555184606464e-4	0.00256550783108236	At_XVE_LST8_suc_24h	At_XVE_LST8_suc_4h	R1067	AT3G02880	F13E7.17;<br>F13E7_17	cytosol; membrane; plant-type cell wall; plasma membrane; plasmodesma	phosphorylation; protein phosphorylation	ATP binding; kinase activity; nucleotide binding; protein binding; protein kinase activity	Leucine-rich repeat protein kinase family protein [Source:NCBI gene (formerly Entrezgene);Acc:821198]	Protein kinase domain; Leucine-rich repeat; Protein kinase-like domain superfamily; Leucine-rich repeat-containing N-terminal, plant-type; Leucine-rich repeat domain superfamily	Q9LV27	Q9LV27
Q9S791	Q9S791_S87	2.0825215682963187	0.25708379678009885	8.81935833688536	-8.10055551683656	2.2599896726924295e-5	1.5187130600493126e-4	At_XVE_LST8_suc_24h	At_XVE_LST8_suc_4h	R1067	AT1G70770	F5A18.5<br>F5A18_5	endoplasmic reticulum; endoplasmic reticulum membrane; Golgi apparatus; membrane; plant-type vacuole; plasma membrane; plasmodesma	NA	mRNA binding	transmembrane protein (Protein of unknown function DUF2359, transmembrane) [Source:NCBI gene (formerly Entrezgene);Acc:843414]	Transmembrane protein 214	Q9LV27	Q9LV27
