Q9FR53	1.4185483231694596	0.03592949082435195	19.677121750223648	39.481447986677544	3.2855961547149384e-20	2.8124703084359874e-19	At_XVE_LST8_suc_24h	At_XVE_GFP_suc_24h	R0967	AT1G50030	F2J10.19;<br>F2J10_19;<br>target of rapamycin	cytoplasm; nucleus; polysome; protein-containing complex	abscisic acid biosynthetic process; auxin-activated signaling pathway; brassinosteroid mediated signaling pathway; defense response; dephosphorylation; embryo development ending in seed dormancy; gravitropism; negative regulation of autophagy; negative regulation of defense response to virus; phosphatidylinositol-3-phosphate biosynthetic process; phosphorylation; positive regulation of abscisic acid biosynthetic process; positive regulation of auxin mediated signaling pathway; positive regulation of brassinosteroid mediated signaling pathway; positive regulation of cell growth; positive regulation of DNA-templated transcription; positive regulation of embryonic development; positive regulation of glucose mediated signaling pathway; positive regulation of rRNA processing; post-embryonic development; response to auxin; response to rapamycin; response to stimulus; response to virus; rRNA transcription; sucrose mediated signaling	1-phosphatidylinositol-3-kinase activity; ATP binding; identical protein binding; kinase activity; nucleotide binding; protein binding; protein kinase activity; protein self-association; protein serine kinase activity; protein serine/threonine kinase activity; protein-containing complex binding; transcription cis-regulatory region binding; transferase activity	target of rapamycin [Source:NCBI gene (formerly Entrezgene);Acc:841427]	Phosphatidylinositol 3-/4-kinase, catalytic domain; PIK-related kinase, FAT; FATC domain; FKBP12-rapamycin binding domain; Protein kinase-like domain superfamily; Armadillo-like helical; Tetratricopeptide-like helical domain superfamily; PIK-related kinase; Armadillo-type fold; Phosphatidylinositol 3/4-kinase, conserved site; Domain of unknown function DUF3385,  target of rapamycin protein; Serine/threonine-protein kinase TOR, catalytic domain; FKBP12-rapamycin binding domain superfamily; Phosphatidylinositol 3-/4-kinase, catalytic domain superfamily	Q9LV27	GFP	1	NA	NA	NA	NA	NA	NA	NA	NA	NA	NA
Q9LV27	4.1717074721183955	0.03924717644281815	19.781017759517265	106.2931871849797	9.448854181634812e-29	4.931840963097195e-27	At_XVE_LST8_suc_24h	At_XVE_GFP_suc_24h	R0967	AT3G18140	Lethal with Sec Thirteen 8-1	endosome; membrane; TORC1 complex; TORC2 complex	long-day photoperiodism; regulation of inositol biosynthetic process; regulation of raffinose biosynthetic process; response to stimulus; TOR signaling	protein binding	Transducin/WD40 repeat-like superfamily protein [Source:NCBI gene (formerly Entrezgene);Acc:821339]	WD40 repeat; WD40/YVTN repeat-like-containing domain superfamily; WD40 repeat, conserved site; G-protein beta WD-40 repeat; WD40-repeat-containing domain superfamily; Target of rapamycin complex subunit LST8	Q9LV27	GFP	1	NA	NA	NA	NA	NA	NA	NA	NA	NA	NA
P29514	1.12500131770073	0.08412935075797853	22.21778208243483	13.372280988321291	4.173245244894809e-12	1.1283447213764276e-11	At_XVE_RAPTOR_suc_24h	At_XVE_GFP_suc_24h	R0967	AT5G12250	beta-6 tubulin;<br>MXC9.21;<br>MXC9_21	cytoplasm; cytoskeleton; microtubule; microtubule cytoskeleton; plastid	cytoskeleton organization; microtubule-based process; response to cold	GTP binding; GTPase activity; metal ion binding; mRNA binding; nucleotide binding; structural constituent of cytoskeleton	beta-6 tubulin [Source:NCBI gene (formerly Entrezgene);Acc:831100]	Tubulin; Beta tubulin; Tubulin/FtsZ, GTPase domain; Tubulin/FtsZ, C-terminal; Beta tubulin, autoregulation binding site; Tubulin, conserved site; Tubulin/FtsZ, 2-layer sandwich domain; Tubulin, C-terminal; Tubulin/FtsZ, GTPase domain superfamily; Tubulin/FtsZ-like, C-terminal domain	Q93YQ1	GFP	1	NA	NA	NA	NA	NA	NA	NA	NA	NA	NA
Q08733	1.469356638109057	0.13304005944530323	24.52370650035133	11.044467690674429	5.2582078825508866e-11	1.3086758596411292e-10	At_XVE_RAPTOR_suc_24h	At_XVE_GFP_suc_24h	R0967	AT1G01620	F22L4.16;<br>F22L4_16;<br>PIP1;3;<br>PLASMA MEMBRANE INTRINSIC PROTEIN 1;3;<br>plasma membrane intrinsic protein 1C;<br>TMP-B	extracellular region; membrane; plasma membrane	response to water deprivation; transmembrane transport; water transport	channel activity; protein binding; water channel activity	plasma membrane intrinsic protein 1C [Source:NCBI gene (formerly Entrezgene);Acc:839235]	Major intrinsic protein; Major intrinsic protein, conserved site; Aquaporin-like; Aquaporin transporter	Q93YQ1	GFP	1	NA	NA	NA	NA	NA	NA	NA	NA	NA	NA
Q43284	1.8922257523616832	0.10739751851288988	23.29593655702591	17.618896400614485	5.778462138029143e-15	1.9231584720656868e-14	At_XVE_RAPTOR_suc_24h	At_XVE_GFP_suc_24h	R0967	AT5G51210	MWD22.16;<br>MWD22_16;<br>oleosin3	lipid droplet; membrane; monolayer-surrounded lipid storage body	post-embryonic development; reproductive structure development	molecular_function	oleosin3 [Source:NCBI gene (formerly Entrezgene);Acc:835196]	Oleosin	Q93YQ1	GFP	1	NA	NA	NA	NA	NA	NA	NA	NA	NA	NA
Q8VZC0	1.1865948690542345	0.16545836318970955	24.681015374846943	7.1715617523287145	1.7511385072915878e-7	3.57579809695038e-7	At_XVE_RAPTOR_suc_24h	At_XVE_GFP_suc_24h	R0967	AT3G53520	ATUXS1;<br>UDP-glucuronic acid decarboxylase 1	cytoplasm; Golgi apparatus; Golgi cisterna membrane; membrane	D-xylose metabolic process; UDP-D-xylose biosynthetic process	carboxy-lyase activity; lyase activity; NAD+ binding; UDP-glucuronate decarboxylase activity	UDP-glucuronic acid decarboxylase 1 [Source:NCBI gene (formerly Entrezgene);Acc:824520]	NAD(P)-binding domain; NAD(P)-binding domain superfamily; UDP-glucuronic acid decarboxylase	Q93YQ1	GFP	1	NA	NA	NA	NA	NA	NA	NA	NA	NA	NA
Q93YQ1	3.3436789854942344	0.0300529862619908	22.13338165447885	111.25945875545544	6.44397013062883e-32	9.850068628246926e-30	At_XVE_RAPTOR_suc_24h	At_XVE_GFP_suc_24h	R0967	AT3G08850	ATRAPTOR1B;<br>RAPTOR1B	Cul4-RING E3 ubiquitin ligase complex; cytoplasm; TORC1 complex	embryo development ending in seed dormancy; maintenance of shoot apical meristem identity; negative regulation of autophagy; TOR signaling	kinase binding; protein binding	Regulatory-associated protein of TOR 1 [Source:NCBI gene (formerly Entrezgene);Acc:820032]	WD40 repeat; Regulatory associated protein of TOR; Armadillo-like helical; WD40/YVTN repeat-like-containing domain superfamily; Armadillo-type fold; Raptor, N-terminal CASPase-like domain; WD40-repeat-containing domain superfamily	Q93YQ1	GFP	1	NA	NA	NA	NA	NA	NA	NA	NA	NA	NA
Q95748	1.5876420473203663	0.1133027793700443	21.20981851893987	14.012383951634265	3.4032038247734338e-12	9.277523802567067e-12	At_XVE_RAPTOR_suc_24h	At_XVE_GFP_suc_24h	R0967	NA	NA	NA	NA	NA	NA	NA	Q93YQ1	GFP	1	NA	NA	NA	NA	NA	NA	NA	NA	NA	NA
Q9FR53	2.96578947073647	0.03576859335445949	19.677121750223648	82.91602192309041	1.6414684613742513e-26	2.9272854227840807e-25	At_XVE_RAPTOR_suc_24h	At_XVE_GFP_suc_24h	R0967	AT1G50030	F2J10.19;<br>F2J10_19;<br>target of rapamycin	cytoplasm; nucleus; polysome; protein-containing complex	abscisic acid biosynthetic process; auxin-activated signaling pathway; brassinosteroid mediated signaling pathway; defense response; dephosphorylation; embryo development ending in seed dormancy; gravitropism; negative regulation of autophagy; negative regulation of defense response to virus; phosphatidylinositol-3-phosphate biosynthetic process; phosphorylation; positive regulation of abscisic acid biosynthetic process; positive regulation of auxin mediated signaling pathway; positive regulation of brassinosteroid mediated signaling pathway; positive regulation of cell growth; positive regulation of DNA-templated transcription; positive regulation of embryonic development; positive regulation of glucose mediated signaling pathway; positive regulation of rRNA processing; post-embryonic development; response to auxin; response to rapamycin; response to stimulus; response to virus; rRNA transcription; sucrose mediated signaling	1-phosphatidylinositol-3-kinase activity; ATP binding; identical protein binding; kinase activity; nucleotide binding; protein binding; protein kinase activity; protein self-association; protein serine kinase activity; protein serine/threonine kinase activity; protein-containing complex binding; transcription cis-regulatory region binding; transferase activity	target of rapamycin [Source:NCBI gene (formerly Entrezgene);Acc:841427]	Phosphatidylinositol 3-/4-kinase, catalytic domain; PIK-related kinase, FAT; FATC domain; FKBP12-rapamycin binding domain; Protein kinase-like domain superfamily; Armadillo-like helical; Tetratricopeptide-like helical domain superfamily; PIK-related kinase; Armadillo-type fold; Phosphatidylinositol 3/4-kinase, conserved site; Domain of unknown function DUF3385,  target of rapamycin protein; Serine/threonine-protein kinase TOR, catalytic domain; FKBP12-rapamycin binding domain superfamily; Phosphatidylinositol 3-/4-kinase, catalytic domain superfamily	Q93YQ1	GFP	1	NA	NA	NA	NA	NA	NA	NA	NA	NA	NA
Q9LJV8	1.1670989241109608	0.07284237460662157	21.693213635979312	16.022252575012406	1.6709743735020864e-13	5.001237985027224e-13	At_XVE_RAPTOR_suc_24h	At_XVE_GFP_suc_24h	R0967	AT3G29075	NA	NA	biological_process	phosphatidic acid binding	glycine-rich protein [Source:NCBI gene (formerly Entrezgene);Acc:822552]	PLD-regulated protein1-like	Q93YQ1	GFP	1	NA	NA	NA	NA	NA	NA	NA	NA	NA	NA
O04603	1.7176443719688712	0.0637931974437978	20.43050867146858	26.925196428382925	1.9482538453957423e-17	2.0141368256748254e-16	At_XVE_LST8_suc_4h	At_XVE_GFP_suc_4h	R0967	AT4G01310	F2N1.5;<br>F2N1_5	chloroplast; chloroplast envelope; chloroplast stroma; cytosol; cytosolic ribosome; plastid; ribonucleoprotein complex; ribosome	translation	mRNA binding; RNA binding; rRNA binding; structural constituent of ribosome	Ribosomal L5P family protein [Source:NCBI gene (formerly Entrezgene);Acc:827947]	Ribosomal protein L5; Ribosomal protein L5, conserved site; Ribosomal protein L5, bacterial-type; Ribosomal protein L5 domain superfamily; Ribosomal protein L5, C-terminal; Ribosomal protein L5, N-terminal	Q9LV27	GFP	1	NA	NA	NA	NA	NA	NA	NA	NA	NA	NA
O65201	1.1442668475774234	0.07199273209481735	24.364716085502195	15.894199515450774	2.299154325744895e-14	1.2331303902491417e-13	At_XVE_LST8_suc_4h	At_XVE_GFP_suc_4h	R0967	AT5G65110	ACYL-COA OXIDASE 2;<br>ATACX2;<br>MQN23.4;<br>MQN23_4	peroxisome	fatty acid beta-oxidation; fatty acid beta-oxidation using acyl-CoA oxidase; fatty acid metabolic process; lipid metabolic process; long-chain fatty acid metabolic process	acyl-CoA oxidase activity; FAD binding; fatty acid binding; oxidoreductase activity; oxidoreductase activity, acting on the CH-CH group of donors	acyl-CoA oxidase 2 [Source:NCBI gene (formerly Entrezgene);Acc:836635]	Acyl-CoA oxidase, C-terminal; Acyl-CoA oxidase/dehydrogenase, middle domain; Acyl-CoA dehydrogenase/oxidase C-terminal; Acyl-CoA dehydrogenase/oxidase, N-terminal and middle domain superfamily; Acyl-CoA oxidase; Peroxisomal acyl-coenzyme A oxidase; Acyl-CoA dehydrogenase-like, C-terminal	Q9LV27	GFP	1	NA	NA	NA	NA	NA	NA	NA	NA	NA	NA
P0DH99	1.1123104830396695	0.05956962139950423	25.90454073345571	18.67244506356602	1.5096815373084335e-16	1.2260077694495713e-15	At_XVE_LST8_suc_4h	At_XVE_GFP_suc_4h	R0967	AT1G07920	T6D22.2;<br>T6D22_2	chloroplast; cytoplasm; cytosol; mitochondrion; nucleolus; nucleus; perinuclear region of cytoplasm; plant-type vacuole; plasma membrane; plasmodesma; vacuole	translation; translational elongation	GTP binding; GTPase activity; mRNA binding; nucleotide binding; protein binding; translation elongation factor activity	GTP binding Elongation factor Tu family protein [Source:NCBI gene (formerly Entrezgene);Acc:837307]	Translational (tr)-type GTP-binding domain; Translation elongation factor EFTu/EF1A, C-terminal; Translation elongation factor EFTu-like, domain 2; Translation elongation factor EF1A, eukaryotic/archaeal; Translation protein, beta-barrel domain superfamily; Translation elongation factor EF1A/initiation factor IF2gamma, C-terminal; P-loop containing nucleoside triphosphate hydrolase; Tr-type G domain, conserved site	Q9LV27	GFP	1	NA	NA	NA	NA	NA	NA	NA	NA	NA	NA
P0DH99	1.1123104830396695	0.05956962139950423	25.90454073345571	18.67244506356602	1.5096815373084335e-16	1.2260077694495713e-15	At_XVE_LST8_suc_4h	At_XVE_GFP_suc_4h	R0967	AT1G07930	T6D22.31	chloroplast; cytoplasm; cytosol; mitochondrion; nucleolus; nucleus; perinuclear region of cytoplasm; plant-type vacuole; plasma membrane; plasmodesma; vacuole	translation; translational elongation	GTP binding; GTPase activity; mRNA binding; nucleotide binding; protein binding; translation elongation factor activity	GTP binding Elongation factor Tu family protein [Source:NCBI gene (formerly Entrezgene);Acc:837308]	Translational (tr)-type GTP-binding domain; Translation elongation factor EFTu/EF1A, C-terminal; Translation elongation factor EFTu-like, domain 2; Translation elongation factor EF1A, eukaryotic/archaeal; Translation protein, beta-barrel domain superfamily; Translation elongation factor EF1A/initiation factor IF2gamma, C-terminal; P-loop containing nucleoside triphosphate hydrolase; Tr-type G domain, conserved site	Q9LV27	GFP	1	NA	NA	NA	NA	NA	NA	NA	NA	NA	NA
P0DH99	1.1123104830396695	0.05956962139950423	25.90454073345571	18.67244506356602	1.5096815373084335e-16	1.2260077694495713e-15	At_XVE_LST8_suc_4h	At_XVE_GFP_suc_4h	R0967	AT1G07940	T6D22.3	chloroplast; cytoplasm; cytosol; mitochondrion; nucleolus; nucleus; perinuclear region of cytoplasm; plant-type vacuole; plasma membrane; plasmodesma; vacuole	translation; translational elongation	GTP binding; GTPase activity; mRNA binding; nucleotide binding; protein binding; translation elongation factor activity	GTP binding Elongation factor Tu family protein [Source:NCBI gene (formerly Entrezgene);Acc:837309]	Translational (tr)-type GTP-binding domain; Translation elongation factor EFTu/EF1A, C-terminal; Translation elongation factor EFTu-like, domain 2; Translation elongation factor EF1A, eukaryotic/archaeal; Translation protein, beta-barrel domain superfamily; Translation elongation factor EF1A/initiation factor IF2gamma, C-terminal; P-loop containing nucleoside triphosphate hydrolase; Tr-type G domain, conserved site	Q9LV27	GFP	1	NA	NA	NA	NA	NA	NA	NA	NA	NA	NA
P0DH99	1.1123104830396695	0.05956962139950423	25.90454073345571	18.67244506356602	1.5096815373084335e-16	1.2260077694495713e-15	At_XVE_LST8_suc_4h	At_XVE_GFP_suc_4h	R0967	AT5G60390	MUF9.8	chloroplast; cytoplasm; cytosol; mitochondrion; nucleolus; nucleus; perinuclear region of cytoplasm; plant-type vacuole; plasma membrane; plasmodesma; vacuole	translation; translational elongation	GTP binding; GTPase activity; mRNA binding; nucleotide binding; protein binding; translation elongation factor activity	GTP binding Elongation factor Tu family protein [Source:NCBI gene (formerly Entrezgene);Acc:836161]	Translational (tr)-type GTP-binding domain; Translation elongation factor EFTu/EF1A, C-terminal; Translation elongation factor EFTu-like, domain 2; Translation elongation factor EF1A, eukaryotic/archaeal; Translation protein, beta-barrel domain superfamily; Translation elongation factor EF1A/initiation factor IF2gamma, C-terminal; P-loop containing nucleoside triphosphate hydrolase; Tr-type G domain, conserved site	Q9LV27	GFP	1	NA	NA	NA	NA	NA	NA	NA	NA	NA	NA
P29514	2.092966792689908	0.0815303249942495	22.21778208243483	25.671022320069607	5.199702451143959e-18	6.251327665982063e-17	At_XVE_LST8_suc_4h	At_XVE_GFP_suc_4h	R0967	AT5G12250	beta-6 tubulin;<br>MXC9.21;<br>MXC9_21	cytoplasm; cytoskeleton; microtubule; microtubule cytoskeleton; plastid	cytoskeleton organization; microtubule-based process; response to cold	GTP binding; GTPase activity; metal ion binding; mRNA binding; nucleotide binding; structural constituent of cytoskeleton	beta-6 tubulin [Source:NCBI gene (formerly Entrezgene);Acc:831100]	Tubulin; Beta tubulin; Tubulin/FtsZ, GTPase domain; Tubulin/FtsZ, C-terminal; Beta tubulin, autoregulation binding site; Tubulin, conserved site; Tubulin/FtsZ, 2-layer sandwich domain; Tubulin, C-terminal; Tubulin/FtsZ, GTPase domain superfamily; Tubulin/FtsZ-like, C-terminal domain	Q9LV27	GFP	1	NA	NA	NA	NA	NA	NA	NA	NA	NA	NA
P31167	1.1152918827152651	0.07906227352908402	23.34633777691568	14.106499003029448	6.450674596839313e-13	2.783153959120188e-12	At_XVE_LST8_suc_4h	At_XVE_GFP_suc_4h	R0967	AT3G08580	ADP/ATP carrier 1	chloroplast; chloroplast envelope; cytosol; membrane; mitochondrial envelope; mitochondrial inner membrane; mitochondrion; nucleolus; plant-type cell wall; plant-type vacuole; plasma membrane; vacuole	mitochondrial ADP transmembrane transport; mitochondrial ATP transmembrane transport; purine nucleotide transport; transmembrane transport	antiporter activity; ATP transmembrane transporter activity; ATP:ADP antiporter activity; copper ion binding; mRNA binding; protein binding	ADP/ATP carrier 1 [Source:NCBI gene (formerly Entrezgene);Acc:820005]	Mitochondrial carrier protein; ADP/ATP carrier protein, eukaryotic type; Mitochondrial substrate/solute carrier; Mitochondrial carrier domain superfamily	Q9LV27	GFP	1	NA	NA	NA	NA	NA	NA	NA	NA	NA	NA
P92959	2.5627136669002155	0.06386408370795062	23.9168116073468	40.12761975290309	1.871849807146335e-23	9.53752044593609e-22	At_XVE_LST8_suc_4h	At_XVE_GFP_suc_4h	R0967	AT5G54600	MRB17.10;<br>MRB17_10;<br>plastid ribosomal protein L24;<br>SUPPRESSOR OF VARIEGATION 8;<br>SVR8	chloroplast; chloroplast envelope; chloroplast stroma; plastid; ribonucleoprotein complex; ribosome	plastid translation; translation	mRNA binding; RNA binding; rRNA binding; structural constituent of ribosome	Translation protein SH3-like family protein [Source:NCBI gene (formerly Entrezgene);Acc:835549]	Ribosomal protein L24; KOW; Ribosomal protein L24/L26, conserved site; Translation protein SH3-like domain superfamily; Ribosomal protein L2, domain 2; Ribosomal protein L26/L24, KOW domain	Q9LV27	GFP	1	NA	NA	NA	NA	NA	NA	NA	NA	NA	NA
P93014	2.3001301892715853	0.05892890537403728	23.472793928435387	39.032291108617294	7.370277379065814e-23	2.7670865949475164e-21	At_XVE_LST8_suc_4h	At_XVE_GFP_suc_4h	R0967	AT2G33800	EMBRYO DEFECTIVE 3113;<br>T1B8.10;<br>T1B8_10	chloroplast; chloroplast stroma; chloroplast thylakoid; chloroplast thylakoid membrane; endoplasmic reticulum; nucleus; plastid; ribonucleoprotein complex; ribosome; small ribosomal subunit; thylakoid	adaxial/abaxial pattern specification; chloroplast rRNA processing; plastid translation; response to cold; translation	mRNA binding; RNA binding; rRNA binding; structural constituent of ribosome	Ribosomal protein S5 family protein [Source:NCBI gene (formerly Entrezgene);Acc:817947]	Ribosomal protein S5; Ribosomal protein S5, C-terminal; Ribosomal protein S5, bacterial-type; Ribosomal protein S5, N-terminal; Ribosomal protein S5 domain 2-type fold, subgroup; Ribosomal protein S5, N-terminal, conserved site; Ribosomal protein S5 domain 2-type fold	Q9LV27	GFP	1	NA	NA	NA	NA	NA	NA	NA	NA	NA	NA
Q08112	1.902327560667208	0.07760849663821824	24.083262853888037	24.51184655122424	1.5357306067535576e-18	2.041281676057524e-17	At_XVE_LST8_suc_4h	At_XVE_GFP_suc_4h	R0967	AT1G04270	cytosolic ribosomal protein S15;<br>F19P19.29;<br>F19P19_29;<br>RIBOSOMAL PROTEIN S15	cytoplasm; cytosolic ribosome; cytosolic small ribosomal subunit; extracellular region; plant-type vacuole; plasmodesma; polysomal ribosome; ribonucleoprotein complex; ribosome; small ribosomal subunit	translation	mRNA binding; RNA binding; structural constituent of ribosome	cytosolic ribosomal protein S15 [Source:NCBI gene (formerly Entrezgene);Acc:839564]	Ribosomal protein S19/S15; Ribosomal protein S19A/S15e; Ribosomal protein S15/S19, conserved site; Ribosomal protein S19/S15, superfamily	Q9LV27	GFP	1	NA	NA	NA	NA	NA	NA	NA	NA	NA	NA
Q43291	1.639235561721075	0.0818028827607866	25.700708491969948	20.038848343702465	3.297876181584303e-17	3.3133591683523044e-16	At_XVE_LST8_suc_4h	At_XVE_GFP_suc_4h	R0967	AT1G09590	F14J9.25	cytosolic large ribosomal subunit; cytosolic ribosome; extracellular region; nucleolus; ribonucleoprotein complex; ribosome	translation	structural constituent of ribosome	Translation protein SH3-like family protein [Source:NCBI gene (formerly Entrezgene);Acc:837486]	Ribosomal protein L21e; Translation protein SH3-like domain superfamily; Ribosomal protein L21e, conserved site; Ribosomal protein L21 superfamily	Q9LV27	GFP	1	NA	NA	NA	NA	NA	NA	NA	NA	NA	NA
Q43291	1.639235561721075	0.0818028827607866	25.700708491969948	20.038848343702465	3.297876181584303e-17	3.3133591683523044e-16	At_XVE_LST8_suc_4h	At_XVE_GFP_suc_4h	R0967	AT1G09690	F21M12.8;<br>F21M12_8	cytosolic large ribosomal subunit; cytosolic ribosome; extracellular region; nucleolus; ribonucleoprotein complex; ribosome	translation	structural constituent of ribosome	Translation protein SH3-like family protein [Source:NCBI gene (formerly Entrezgene);Acc:837497]	Ribosomal protein L21e; Translation protein SH3-like domain superfamily; Ribosomal protein L21e, conserved site; Ribosomal protein L21 superfamily	Q9LV27	GFP	1	NA	NA	NA	NA	NA	NA	NA	NA	NA	NA
Q66GI4	2.420560445091436	0.14694491303864385	23.55548776955252	16.472570537061547	1.9990921817496452e-14	1.0858013372954925e-13	At_XVE_LST8_suc_4h	At_XVE_GFP_suc_4h	R0967	AT2G32230	F22D22.2;<br>F22D22_2;<br>proteinaceous RNase P 1	chloroplast; intracellular membrane-bounded organelle; mitochondrion; plastid	tRNA 5'-leader removal; tRNA processing	hydrolase activity; metal ion binding; nuclease activity; protein binding; ribonuclease P activity	proteinaceous RNase P 1 [Source:NCBI gene (formerly Entrezgene);Acc:817782]	Pentatricopeptide repeat; Tetratricopeptide-like helical domain superfamily; Protein-only RNase P, C-terminal; Pentacotripeptide-repeat region of PRORP	Q9LV27	GFP	1	NA	NA	NA	NA	NA	NA	NA	NA	NA	NA
Q8RXU5	3.670947261492781	0.09641574499675916	19.45629700855352	38.07414713868749	9.662455051766149e-20	1.654212304862365e-18	At_XVE_LST8_suc_4h	At_XVE_GFP_suc_4h	R0967	AT3G60245	NA	cytosol; cytosolic large ribosomal subunit; ribonucleoprotein complex; ribosome	translation	metal ion binding; molecular_function; structural constituent of ribosome	Zinc-binding ribosomal protein family protein [Source:NCBI gene (formerly Entrezgene);Acc:825195]	Ribosomal protein L37ae; Ribosomal protein L37ae/L37e; Zinc-binding ribosomal protein	Q9LV27	GFP	1	NA	NA	NA	NA	NA	NA	NA	NA	NA	NA
Q9ASV6	2.129821860102868	0.08868243778721836	22.20697123462918	24.01627552473343	2.203039076045385e-17	2.245001725112916e-16	At_XVE_LST8_suc_4h	At_XVE_GFP_suc_4h	R0967	AT3G15190	plastid ribosomal protein S20	chloroplast; chloroplast envelope; chloroplast stroma; cytosol; plastid; ribonucleoprotein complex; ribosome	translation	mRNA binding; RNA binding; rRNA binding; structural constituent of ribosome	chloroplast 30S ribosomal protein S20 [Source:NCBI gene (formerly Entrezgene);Acc:820750]	Ribosomal protein S20; Ribosomal protein S20 superfamily	Q9LV27	GFP	1	NA	NA	NA	NA	NA	NA	NA	NA	NA	NA
Q9FHG2	2.180748607738245	0.06356336646753794	23.059747647889743	34.308261643944896	2.6925474318393575e-21	6.195754305522823e-20	At_XVE_LST8_suc_4h	At_XVE_GFP_suc_4h	R0967	AT5G46430	K11I1.2;<br>K11I1_2	cytosolic large ribosomal subunit; plastid; ribonucleoprotein complex; ribosome	translation	mRNA binding; structural constituent of ribosome	Ribosomal protein L32e [Source:NCBI gene (formerly Entrezgene);Acc:834686]	Ribosomal protein L32e; Ribosomal protein L32e, conserved site; Ribosomal protein L32e superfamily	Q9LV27	GFP	1	NA	NA	NA	NA	NA	NA	NA	NA	NA	NA
Q9FJP3	2.372229776413562	0.04961156736293927	22.402418771724054	47.81606190869229	4.730188067873007e-24	3.1633132703900735e-22	At_XVE_LST8_suc_4h	At_XVE_GFP_suc_4h	R0967	AT5G65220	MQN23.16;<br>MQN23_16	chloroplast; chloroplast envelope; chloroplast nucleoid; chloroplast stroma; plastid; ribonucleoprotein complex; ribosome	translation	structural constituent of ribosome	Ribosomal L29 family protein [Source:NCBI gene (formerly Entrezgene);Acc:836647]	Ribosomal protein L29/L35; Ribosomal protein L29/L35 superfamily	Q9LV27	GFP	1	NA	NA	NA	NA	NA	NA	NA	NA	NA	NA
Q9FWS4	2.1933515664464376	0.04757297531126959	22.85157027765108	46.10499032476645	4.7232024855540344e-24	3.1633132703900735e-22	At_XVE_LST8_suc_4h	At_XVE_GFP_suc_4h	R0967	AT1G75350	embryo defective 2184;<br>F1B16.11;<br>F1B16_11	chloroplast; chloroplast envelope; chloroplast stroma; mitochondrion; plastid; ribonucleoprotein complex; ribosome	translation	RNA binding; rRNA binding; structural constituent of ribosome	Ribosomal protein L31 [Source:NCBI gene (formerly Entrezgene);Acc:843871]	Ribosomal protein L31; L28p-like; Ribosomal protein L31 superfamily	Q9LV27	GFP	1	NA	NA	NA	NA	NA	NA	NA	NA	NA	NA
Q9FZ76	1.05747463197707	0.08262722204505589	25.74653248930137	12.798138504528673	1.1502154666135253e-12	4.798169782754278e-12	At_XVE_LST8_suc_4h	At_XVE_GFP_suc_4h	R0967	AT1G18540	F25I16.12;<br>F25I16_12	cytosolic large ribosomal subunit; cytosolic ribosome; endoplasmic reticulum; nucleus; plasma membrane; plasmodesma; ribonucleoprotein complex; ribosome	translation	mRNA binding; structural constituent of ribosome	Ribosomal protein L6 family protein [Source:NCBI gene (formerly Entrezgene);Acc:838435]	60S ribosomal protein L6E; Ribosomal protein L6, N-terminal; Translation protein SH3-like domain superfamily; Ribosomal protein L2, domain 2; Ribosomal Protein L6, KOW domain	Q9LV27	GFP	1	NA	NA	NA	NA	NA	NA	NA	NA	NA	NA
