P0DH99	1.2766826237392763	0.07028116227503284	13.065994686887382	18.165360139367156	1.1780607202087128e-10	1.310592551232193e-9	At_XVE_RAPTOR_suc_4h_TiO	At_XVE_GFP_suc_4h_TiO	R1067	AT5G60390	MUF9.8	chloroplast; cytoplasm; cytosol; mitochondrion; nucleolus; nucleus; perinuclear region of cytoplasm; plant-type vacuole; plasma membrane; plasmodesma; vacuole	translation; translational elongation	GTP binding; GTPase activity; mRNA binding; nucleotide binding; protein binding; translation elongation factor activity	GTP binding Elongation factor Tu family protein [Source:NCBI gene (formerly Entrezgene);Acc:836161]	Translational (tr)-type GTP-binding domain; Translation elongation factor EFTu/EF1A, C-terminal; Translation elongation factor EFTu-like, domain 2; Translation elongation factor EF1A, eukaryotic/archaeal; Translation protein, beta-barrel domain superfamily; Translation elongation factor EF1A/initiation factor IF2gamma, C-terminal; P-loop containing nucleoside triphosphate hydrolase; Tr-type G domain, conserved site	Q93YQ1	GFP	1	NA	NA	NA	NA	NA	NA	NA	NA	NA	NA
P29514	2.60800619393468	0.11951115283922602	11.844261516148642	21.822282958337247	6.259964555865128e-11	7.30041383721926e-10	At_XVE_RAPTOR_suc_4h_TiO	At_XVE_GFP_suc_4h_TiO	R1067	AT5G12250	beta-6 tubulin;<br>MXC9.21;<br>MXC9_21	cytoplasm; cytoskeleton; microtubule; microtubule cytoskeleton; plastid	cytoskeleton organization; microtubule-based process; response to cold	GTP binding; GTPase activity; metal ion binding; mRNA binding; nucleotide binding; structural constituent of cytoskeleton	beta-6 tubulin [Source:NCBI gene (formerly Entrezgene);Acc:831100]	Tubulin; Beta tubulin; Tubulin/FtsZ, GTPase domain; Tubulin/FtsZ, C-terminal; Beta tubulin, autoregulation binding site; Tubulin, conserved site; Tubulin/FtsZ, 2-layer sandwich domain; Tubulin, C-terminal; Tubulin/FtsZ, GTPase domain superfamily; Tubulin/FtsZ-like, C-terminal domain	Q93YQ1	GFP	1	NA	NA	NA	NA	NA	NA	NA	NA	NA	NA
P92959	2.0102597168306	0.07516401913698542	13.41978063714103	26.744973724288588	4.932869137232687e-13	1.2449972703075336e-11	At_XVE_RAPTOR_suc_4h_TiO	At_XVE_GFP_suc_4h_TiO	R1067	AT5G54600	MRB17.10;<br>MRB17_10;<br>plastid ribosomal protein L24;<br>SUPPRESSOR OF VARIEGATION 8;<br>SVR8	chloroplast; chloroplast envelope; chloroplast stroma; plastid; ribonucleoprotein complex; ribosome	plastid translation; translation	mRNA binding; RNA binding; rRNA binding; structural constituent of ribosome	Translation protein SH3-like family protein [Source:NCBI gene (formerly Entrezgene);Acc:835549]	Ribosomal protein L24; KOW; Ribosomal protein L24/L26, conserved site; Translation protein SH3-like domain superfamily; Ribosomal protein L2, domain 2; Ribosomal protein L26/L24, KOW domain	Q93YQ1	GFP	1	NA	NA	NA	NA	NA	NA	NA	NA	NA	NA
P93014	2.384382510775037	0.09905399007529316	14.338481909021365	24.071544305914525	5.336378380624628e-13	1.289116548805178e-11	At_XVE_RAPTOR_suc_4h_TiO	At_XVE_GFP_suc_4h_TiO	R1067	AT2G33800	EMBRYO DEFECTIVE 3113;<br>T1B8.10;<br>T1B8_10	chloroplast; chloroplast stroma; chloroplast thylakoid; chloroplast thylakoid membrane; endoplasmic reticulum; nucleus; plastid; ribonucleoprotein complex; ribosome; small ribosomal subunit; thylakoid	adaxial/abaxial pattern specification; chloroplast rRNA processing; plastid translation; response to cold; translation	mRNA binding; RNA binding; rRNA binding; structural constituent of ribosome	Ribosomal protein S5 family protein [Source:NCBI gene (formerly Entrezgene);Acc:817947]	Ribosomal protein S5; Ribosomal protein S5, C-terminal; Ribosomal protein S5, bacterial-type; Ribosomal protein S5, N-terminal; Ribosomal protein S5 domain 2-type fold, subgroup; Ribosomal protein S5, N-terminal, conserved site; Ribosomal protein S5 domain 2-type fold	Q93YQ1	GFP	1	NA	NA	NA	NA	NA	NA	NA	NA	NA	NA
Q08112	2.3034318347301	0.08206134688714856	13.0235606510767	28.0696323190722	4.905043001751138e-13	1.2449972703075336e-11	At_XVE_RAPTOR_suc_4h_TiO	At_XVE_GFP_suc_4h_TiO	R1067	AT1G04270	cytosolic ribosomal protein S15;<br>F19P19.29;<br>F19P19_29;<br>RIBOSOMAL PROTEIN S15	cytoplasm; cytosolic ribosome; cytosolic small ribosomal subunit; extracellular region; plant-type vacuole; plasmodesma; polysomal ribosome; ribonucleoprotein complex; ribosome; small ribosomal subunit	translation	mRNA binding; RNA binding; structural constituent of ribosome	cytosolic ribosomal protein S15 [Source:NCBI gene (formerly Entrezgene);Acc:839564]	Ribosomal protein S19/S15; Ribosomal protein S19A/S15e; Ribosomal protein S15/S19, conserved site; Ribosomal protein S19/S15, superfamily	Q93YQ1	GFP	1	NA	NA	NA	NA	NA	NA	NA	NA	NA	NA
Q08733	1.392201986813766	0.218689304647406	12.09200074101224	6.366118311356932	3.454159465392951e-5	9.93364567343449e-5	At_XVE_RAPTOR_suc_4h_TiO	At_XVE_GFP_suc_4h_TiO	R1067	AT1G01620	F22L4.16;<br>F22L4_16;<br>PIP1;3;<br>PLASMA MEMBRANE INTRINSIC PROTEIN 1;3;<br>plasma membrane intrinsic protein 1C;<br>TMP-B	extracellular region; membrane; plasma membrane	response to water deprivation; transmembrane transport; water transport	channel activity; protein binding; water channel activity	plasma membrane intrinsic protein 1C [Source:NCBI gene (formerly Entrezgene);Acc:839235]	Major intrinsic protein; Major intrinsic protein, conserved site; Aquaporin-like; Aquaporin transporter	Q93YQ1	GFP	1	NA	NA	NA	NA	NA	NA	NA	NA	NA	NA
Q43284	1.9810518469358989	0.09723748040867444	10.266769066811024	20.37333586400879	1.224235659997501e-9	1.0197943354954554e-8	At_XVE_RAPTOR_suc_4h_TiO	At_XVE_GFP_suc_4h_TiO	R1067	AT5G51210	MWD22.16;<br>MWD22_16;<br>oleosin3	lipid droplet; membrane; monolayer-surrounded lipid storage body	post-embryonic development; reproductive structure development	molecular_function	oleosin3 [Source:NCBI gene (formerly Entrezgene);Acc:835196]	Oleosin	Q93YQ1	GFP	1	NA	NA	NA	NA	NA	NA	NA	NA	NA	NA
Q43291	2.090689671448039	0.10317594336793008	14.590076418768692	20.26334437275311	4.3185549740206986e-12	7.687027853756844e-11	At_XVE_RAPTOR_suc_4h_TiO	At_XVE_GFP_suc_4h_TiO	R1067	AT1G09590	F14J9.25	cytosolic large ribosomal subunit; cytosolic ribosome; extracellular region; nucleolus; ribonucleoprotein complex; ribosome	translation	structural constituent of ribosome	Translation protein SH3-like family protein [Source:NCBI gene (formerly Entrezgene);Acc:837486]	Ribosomal protein L21e; Translation protein SH3-like domain superfamily; Ribosomal protein L21e, conserved site; Ribosomal protein L21 superfamily	Q93YQ1	GFP	1	NA	NA	NA	NA	NA	NA	NA	NA	NA	NA
Q43291	2.090689671448039	0.10317594336793008	14.590076418768692	20.26334437275311	4.3185549740206986e-12	7.687027853756844e-11	At_XVE_RAPTOR_suc_4h_TiO	At_XVE_GFP_suc_4h_TiO	R1067	AT1G09690	F21M12.8;<br>F21M12_8	cytosolic large ribosomal subunit; cytosolic ribosome; extracellular region; nucleolus; ribonucleoprotein complex; ribosome	translation	structural constituent of ribosome	Translation protein SH3-like family protein [Source:NCBI gene (formerly Entrezgene);Acc:837497]	Ribosomal protein L21e; Translation protein SH3-like domain superfamily; Ribosomal protein L21e, conserved site; Ribosomal protein L21 superfamily	Q93YQ1	GFP	1	NA	NA	NA	NA	NA	NA	NA	NA	NA	NA
Q8RXU5	2.197601163769	0.1212983747049424	13.788655841736862	18.11731747531368	5.220392026798005e-11	6.26076802646484e-10	At_XVE_RAPTOR_suc_4h_TiO	At_XVE_GFP_suc_4h_TiO	R1067	AT3G60245	NA	cytosol; cytosolic large ribosomal subunit; ribonucleoprotein complex; ribosome	translation	metal ion binding; molecular_function; structural constituent of ribosome	Zinc-binding ribosomal protein family protein [Source:NCBI gene (formerly Entrezgene);Acc:825195]	Ribosomal protein L37ae; Ribosomal protein L37ae/L37e; Zinc-binding ribosomal protein	Q93YQ1	GFP	1	NA	NA	NA	NA	NA	NA	NA	NA	NA	NA
Q93YQ1	1.5229830271879798	0.05286442177920223	11.33956098480402	28.809225106991473	5.794951455372017e-12	9.797275381351708e-11	At_XVE_RAPTOR_suc_4h_TiO	At_XVE_GFP_suc_4h_TiO	R1067	AT3G08850	ATRAPTOR1B;<br>RAPTOR1B	Cul4-RING E3 ubiquitin ligase complex; cytoplasm; TORC1 complex	embryo development ending in seed dormancy; maintenance of shoot apical meristem identity; negative regulation of autophagy; TOR signaling	kinase binding; protein binding	Regulatory-associated protein of TOR 1 [Source:NCBI gene (formerly Entrezgene);Acc:820032]	WD40 repeat; Regulatory associated protein of TOR; Armadillo-like helical; WD40/YVTN repeat-like-containing domain superfamily; Armadillo-type fold; Raptor, N-terminal CASPase-like domain; WD40-repeat-containing domain superfamily	Q93YQ1	GFP	1	NA	NA	NA	NA	NA	NA	NA	NA	NA	NA
Q95748	1.053419792635312	0.0667241424564136	11.707694842625592	15.787685743933544	2.9878420981143646e-9	2.3070506794115937e-8	At_XVE_RAPTOR_suc_4h_TiO	At_XVE_GFP_suc_4h_TiO	R1067	NA	NA	NA	NA	NA	NA	NA	Q93YQ1	GFP	1	NA	NA	NA	NA	NA	NA	NA	NA	NA	NA
Q9ASV6	2.6572446360800805	0.09320556730120996	13.011034264477058	28.509505526560805	4.100332852322788e-13	1.129593069418208e-11	At_XVE_RAPTOR_suc_4h_TiO	At_XVE_GFP_suc_4h_TiO	R1067	AT3G15190	plastid ribosomal protein S20	chloroplast; chloroplast envelope; chloroplast stroma; cytosol; plastid; ribonucleoprotein complex; ribosome	translation	mRNA binding; RNA binding; rRNA binding; structural constituent of ribosome	chloroplast 30S ribosomal protein S20 [Source:NCBI gene (formerly Entrezgene);Acc:820750]	Ribosomal protein S20; Ribosomal protein S20 superfamily	Q93YQ1	GFP	1	NA	NA	NA	NA	NA	NA	NA	NA	NA	NA
Q9FHG2	2.4108741183814737	0.14696001595413394	11.325374633103516	16.40496636264591	3.0218509167594255e-9	2.3227045001091767e-8	At_XVE_RAPTOR_suc_4h_TiO	At_XVE_GFP_suc_4h_TiO	R1067	AT5G46430	K11I1.2;<br>K11I1_2	cytosolic large ribosomal subunit; plastid; ribonucleoprotein complex; ribosome	translation	mRNA binding; structural constituent of ribosome	Ribosomal protein L32e [Source:NCBI gene (formerly Entrezgene);Acc:834686]	Ribosomal protein L32e; Ribosomal protein L32e, conserved site; Ribosomal protein L32e superfamily	Q93YQ1	GFP	1	NA	NA	NA	NA	NA	NA	NA	NA	NA	NA
Q9FJP3	2.3958756623421076	0.07981901845254386	13.24091179402098	30.01635084959818	1.444223196267871e-13	5.4270698330865986e-12	At_XVE_RAPTOR_suc_4h_TiO	At_XVE_GFP_suc_4h_TiO	R1067	AT5G65220	MQN23.16;<br>MQN23_16	chloroplast; chloroplast envelope; chloroplast nucleoid; chloroplast stroma; plastid; ribonucleoprotein complex; ribosome	translation	structural constituent of ribosome	Ribosomal L29 family protein [Source:NCBI gene (formerly Entrezgene);Acc:836647]	Ribosomal protein L29/L35; Ribosomal protein L29/L35 superfamily	Q93YQ1	GFP	1	NA	NA	NA	NA	NA	NA	NA	NA	NA	NA
Q9FR53	1.085089907430747	0.07739785442118607	12.494242879608809	14.01963808358137	5.162581154858486e-9	3.6835125455129545e-8	At_XVE_RAPTOR_suc_4h_TiO	At_XVE_GFP_suc_4h_TiO	R1067	AT1G50030	F2J10.19;<br>F2J10_19;<br>target of rapamycin	cytoplasm; nucleus; polysome; protein-containing complex	abscisic acid biosynthetic process; auxin-activated signaling pathway; brassinosteroid mediated signaling pathway; defense response; dephosphorylation; embryo development ending in seed dormancy; gravitropism; negative regulation of autophagy; negative regulation of defense response to virus; phosphatidylinositol-3-phosphate biosynthetic process; phosphorylation; positive regulation of abscisic acid biosynthetic process; positive regulation of auxin mediated signaling pathway; positive regulation of brassinosteroid mediated signaling pathway; positive regulation of cell growth; positive regulation of DNA-templated transcription; positive regulation of embryonic development; positive regulation of glucose mediated signaling pathway; positive regulation of rRNA processing; post-embryonic development; response to auxin; response to rapamycin; response to stimulus; response to virus; rRNA transcription; sucrose mediated signaling	1-phosphatidylinositol-3-kinase activity; ATP binding; identical protein binding; kinase activity; nucleotide binding; protein binding; protein kinase activity; protein self-association; protein serine kinase activity; protein serine/threonine kinase activity; protein-containing complex binding; transcription cis-regulatory region binding; transferase activity	target of rapamycin [Source:NCBI gene (formerly Entrezgene);Acc:841427]	Phosphatidylinositol 3-/4-kinase, catalytic domain; PIK-related kinase, FAT; FATC domain; FKBP12-rapamycin binding domain; Protein kinase-like domain superfamily; Armadillo-like helical; Tetratricopeptide-like helical domain superfamily; PIK-related kinase; Armadillo-type fold; Phosphatidylinositol 3/4-kinase, conserved site; Domain of unknown function DUF3385,  target of rapamycin protein; Serine/threonine-protein kinase TOR, catalytic domain; FKBP12-rapamycin binding domain superfamily; Phosphatidylinositol 3-/4-kinase, catalytic domain superfamily	Q93YQ1	GFP	1	NA	NA	NA	NA	NA	NA	NA	NA	NA	NA
Q9FWS4	2.7044143243675407	0.08164334812048434	12.24332249213222	33.12473565362029	2.342802771027739e-13	7.336443492236864e-12	At_XVE_RAPTOR_suc_4h_TiO	At_XVE_GFP_suc_4h_TiO	R1067	AT1G75350	embryo defective 2184;<br>F1B16.11;<br>F1B16_11	chloroplast; chloroplast envelope; chloroplast stroma; mitochondrion; plastid; ribonucleoprotein complex; ribosome	translation	RNA binding; rRNA binding; structural constituent of ribosome	Ribosomal protein L31 [Source:NCBI gene (formerly Entrezgene);Acc:843871]	Ribosomal protein L31; L28p-like; Ribosomal protein L31 superfamily	Q93YQ1	GFP	1	NA	NA	NA	NA	NA	NA	NA	NA	NA	NA
Q9FZ76	1.0252689360908755	0.06709589014346595	13.4186531394601	15.28065182380951	7.14975834552989e-10	6.3632849275216046e-9	At_XVE_RAPTOR_suc_4h_TiO	At_XVE_GFP_suc_4h_TiO	R1067	AT1G18540	F25I16.12;<br>F25I16_12	cytosolic large ribosomal subunit; cytosolic ribosome; endoplasmic reticulum; nucleus; plasma membrane; plasmodesma; ribonucleoprotein complex; ribosome	translation	mRNA binding; structural constituent of ribosome	Ribosomal protein L6 family protein [Source:NCBI gene (formerly Entrezgene);Acc:838435]	60S ribosomal protein L6E; Ribosomal protein L6, N-terminal; Translation protein SH3-like domain superfamily; Ribosomal protein L2, domain 2; Ribosomal Protein L6, KOW domain	Q93YQ1	GFP	1	NA	NA	NA	NA	NA	NA	NA	NA	NA	NA
Q9LX88	1.6511251444097397	0.18248692493744875	12.94652255867112	9.047909295286212	5.853309350039614e-7	2.493185418366999e-6	At_XVE_RAPTOR_suc_4h_TiO	At_XVE_GFP_suc_4h_TiO	R1067	AT3G46040	ribosomal protein S15A D	cytosol; cytosolic ribosome; cytosolic small ribosomal subunit; polysomal ribosome; ribonucleoprotein complex; ribosome	translation	structural constituent of ribosome	ribosomal protein S15A D [Source:NCBI gene (formerly Entrezgene);Acc:823747]	Ribosomal protein S8; Ribosomal protein S8 superfamily	Q93YQ1	GFP	1	NA	NA	NA	NA	NA	NA	NA	NA	NA	NA
Q9M339	1.318078858798555	0.0773859904256292	10.55396297040306	17.032525545631902	5.13153555703987e-9	3.6768756893874675e-8	At_XVE_RAPTOR_suc_4h_TiO	At_XVE_GFP_suc_4h_TiO	R1067	AT3G53870	NA	cytosol; cytosolic ribosome; cytosolic small ribosomal subunit; plasmodesma; polysomal ribosome; ribonucleoprotein complex; ribosome; small ribosomal subunit	translation	mRNA binding; RNA binding; structural constituent of ribosome	Ribosomal protein S3 family protein [Source:NCBI gene (formerly Entrezgene);Acc:824554]	Ribosomal protein S3, C-terminal; K Homology domain, type 2; Ribosomal protein S3, eukaryotic/archaeal; K homology domain superfamily, prokaryotic type; K homology domain-like, alpha/beta; Ribosomal protein S3, C-terminal domain superfamily	Q93YQ1	GFP	1	NA	NA	NA	NA	NA	NA	NA	NA	NA	NA
Q9M884	1.3567312365601696	0.07538676736261628	12.8225087037978	17.9969414265263	1.7675342169914915e-10	1.800542386103983e-9	At_XVE_RAPTOR_suc_4h_TiO	At_XVE_GFP_suc_4h_TiO	R1067	AT3G02570	F16B3.20;<br>F16B3_20;<br>MATERNAL EFFECT EMBRYO ARREST 31;<br>PHOSPHOMANNOSE ISOMERASE 1;<br>PMI1	NA	carbohydrate metabolic process; embryo development ending in seed dormancy; GDP-mannose biosynthetic process; response to cadmium ion; response to cobalt ion; response to L-ascorbic acid; response to light stimulus; response to zinc ion	isomerase activity; mannose-6-phosphate isomerase activity; metal ion binding; zinc ion binding	Mannose-6-phosphate isomerase, type I [Source:NCBI gene (formerly Entrezgene);Acc:820656]	Mannose-6-phosphate isomerase, type I; RmlC-like cupin domain superfamily; RmlC-like jelly roll fold; Mannose-6-phosphate isomerase; Phosphomannose isomerase, type I, conserved site; Phosphomannose isomerase type I, C-terminal domain; Phosphomannose isomerase type I, catalytic domain; Phosphomannose isomerase type I, helical insertion domain	Q93YQ1	GFP	1	NA	NA	NA	NA	NA	NA	NA	NA	NA	NA
Q9SRX2	1.951575044372831	0.11094668401158048	14.467524385978074	17.59020615856467	3.609174299530668e-11	4.62357101553512e-10	At_XVE_RAPTOR_suc_4h_TiO	At_XVE_GFP_suc_4h_TiO	R1067	AT1G02780	embryo defective 2386;<br>T14P4.34	cytosol; cytosolic large ribosomal subunit; cytosolic ribosome; extracellular region; nucleolus; plasmodesma; polysomal ribosome; ribonucleoprotein complex; ribosome	translation	mRNA binding; RNA binding; structural constituent of ribosome	Ribosomal protein L19e family protein [Source:NCBI gene (formerly Entrezgene);Acc:839407]	Ribosomal protein L19/L19e; Ribosomal protein L19/L19e, domain 1; Ribosomal protein L19/L19e conserved site; Ribosomal protein L19, eukaryotic; Ribosomal protein L19/L19e superfamily; 60S ribosomal protein L19	Q93YQ1	GFP	1	NA	NA	NA	NA	NA	NA	NA	NA	NA	NA
F4J6A1	2.0649502878143116	0.1124275570253578	12.42905678952402	18.36694083238477	2.2168135791168598e-10	2.213931089504515e-9	At_XVE_RAPTOR_suc_4h_TiO	At_XVE_GFP_suc_4h_TiO	R1067	AT3G11400	ATEIF3G1<br>eukaryotic translation initiation factor 3G1	cytoplasm; cytosol; eukaryotic 43S preinitiation complex; eukaryotic 48S preinitiation complex; eukaryotic translation initiation factor 3 complex	cytoplasmic translational initiation; formation of cytoplasmic translation initiation complex; translation; translational initiation	mRNA binding; nucleic acid binding; protein binding; RNA binding; translation initiation factor activity	eukaryotic translation initiation factor 3G1 [Source:NCBI gene (formerly Entrezgene);Acc:820313]	RNA recognition motif domain; Nucleotide-binding alpha-beta plait domain superfamily; Eukaryotic translation initiation factor 3 subunit G; Eukaryotic translation initiation factor 3 subunit G, N-terminal; eIF3G, RNA recognition motif; RNA-binding domain superfamily	Q93YQ1	GFP	1	NA	NA	NA	NA	NA	NA	NA	NA	NA	NA
F4K087	2.23346044726026	0.10336445452084723	14.04058644652362	21.60762573182061	3.565523641869636e-12	6.483118793980167e-11	At_XVE_RAPTOR_suc_4h_TiO	At_XVE_GFP_suc_4h_TiO	R1067	AT5G48240	MIF21.13<br>MIF21_13	nucleolus	rRNA processing	NA	Rrp15p protein [Source:NCBI gene (formerly Entrezgene);Acc:834877]	Ribosomal RNA-processing protein 15	Q93YQ1	GFP	1	NA	NA	NA	NA	NA	NA	NA	NA	NA	NA
Q39100	1.8132896837894743	0.18308559476991387	12.033772109195926	9.904054363579286	3.881581150611988e-7	1.7227700067414362e-6	At_XVE_RAPTOR_suc_4h_TiO	At_XVE_GFP_suc_4h_TiO	R1067	AT5G46900	MQD22.3<br>MQD22_3	NA	NA	molecular_function	Bifunctional inhibitor/lipid-transfer protein/seed storage 2S albumin superfamily protein [Source:NCBI gene (formerly Entrezgene);Acc:834735]	Bifunctional inhibitor/plant lipid transfer protein/seed storage helical domain; Hydrophobic seed protein domain; Bifunctional inhibitor/plant lipid transfer protein/seed storage helical domain superfamily	Q93YQ1	GFP	1	NA	NA	NA	NA	NA	NA	NA	NA	NA	NA
Q9LJV8	1.371040082072824	0.23809735917648112	13.45108720380702	5.758317046501089	5.7908924895738666e-5	1.5948532898810112e-4	At_XVE_RAPTOR_suc_4h_TiO	At_XVE_GFP_suc_4h_TiO	R1067	AT3G29075	NA	NA	biological_process	phosphatidic acid binding	glycine-rich protein [Source:NCBI gene (formerly Entrezgene);Acc:822552]	PLD-regulated protein1-like	Q93YQ1	GFP	1	NA	NA	NA	NA	NA	NA	NA	NA	NA	NA
Q9SR09	1.7537446132353431	0.14344519278252713	13.327942216281304	12.22588627207704	1.271906200148187e-8	8.177921613880548e-8	At_XVE_RAPTOR_suc_4h_TiO	At_XVE_GFP_suc_4h_TiO	R1067	AT3G04650	F7O18.13<br>F7O18_13	chloroplast; cytosol	NA	molecular_function	FAD/NAD(P)-binding oxidoreductase family protein [Source:NCBI gene (formerly Entrezgene);Acc:819623]	FAD/NAD(P)-binding domain superfamily	Q93YQ1	GFP	1	NA	NA	NA	NA	NA	NA	NA	NA	NA	NA
Q9FZ76	1.036764121694588	0.0698091295787021	13.4186531394601	14.851411669955729	1.0272171911166814e-9	3.1018290538898375e-8	At_XVE_LST8_suc_4h_TiO	At_XVE_LST8_suc_24h_TiO	R1067	AT1G18540	F25I16.12;<br>F25I16_12	cytosolic large ribosomal subunit; cytosolic ribosome; endoplasmic reticulum; nucleus; plasma membrane; plasmodesma; ribonucleoprotein complex; ribosome	translation	mRNA binding; structural constituent of ribosome	Ribosomal protein L6 family protein [Source:NCBI gene (formerly Entrezgene);Acc:838435]	60S ribosomal protein L6E; Ribosomal protein L6, N-terminal; Translation protein SH3-like domain superfamily; Ribosomal protein L2, domain 2; Ribosomal Protein L6, KOW domain	Q9LV27	Q9LV27	1	NA	NA	NA	NA	NA	NA	NA	NA	NA	NA
Q08733	1.4759567319071387	0.22773663362915533	12.09200074101224	6.480980720522004	2.912442464409176e-5	8.857806128266037e-5	At_XVE_RAPTOR_suc_24h_TiO	At_XVE_LST8_suc_24h_TiO	R1067	AT1G01620	F22L4.16;<br>F22L4_16;<br>PIP1;3;<br>PLASMA MEMBRANE INTRINSIC PROTEIN 1;3;<br>plasma membrane intrinsic protein 1C;<br>TMP-B	extracellular region; membrane; plasma membrane	response to water deprivation; transmembrane transport; water transport	channel activity; protein binding; water channel activity	plasma membrane intrinsic protein 1C [Source:NCBI gene (formerly Entrezgene);Acc:839235]	Major intrinsic protein; Major intrinsic protein, conserved site; Aquaporin-like; Aquaporin transporter	Q93YQ1	Q9LV27	1	NA	NA	NA	NA	NA	NA	NA	NA	NA	NA
Q43284	1.782885142161834	0.08596228136819405	10.266769066811024	20.740319053718128	1.0232898118261814e-9	1.1309693279725964e-8	At_XVE_RAPTOR_suc_24h_TiO	At_XVE_LST8_suc_24h_TiO	R1067	AT5G51210	MWD22.16;<br>MWD22_16;<br>oleosin3	lipid droplet; membrane; monolayer-surrounded lipid storage body	post-embryonic development; reproductive structure development	molecular_function	oleosin3 [Source:NCBI gene (formerly Entrezgene);Acc:835196]	Oleosin	Q93YQ1	Q9LV27	1	NA	NA	NA	NA	NA	NA	NA	NA	NA	NA
Q93YQ1	2.7039085789617165	0.06136098941444462	11.33956098480402	44.06559615098393	4.872783092137648e-14	3.0518060032610233e-12	At_XVE_RAPTOR_suc_24h_TiO	At_XVE_LST8_suc_24h_TiO	R1067	AT3G08850	ATRAPTOR1B;<br>RAPTOR1B	Cul4-RING E3 ubiquitin ligase complex; cytoplasm; TORC1 complex	embryo development ending in seed dormancy; maintenance of shoot apical meristem identity; negative regulation of autophagy; TOR signaling	kinase binding; protein binding	Regulatory-associated protein of TOR 1 [Source:NCBI gene (formerly Entrezgene);Acc:820032]	WD40 repeat; Regulatory associated protein of TOR; Armadillo-like helical; WD40/YVTN repeat-like-containing domain superfamily; Armadillo-type fold; Raptor, N-terminal CASPase-like domain; WD40-repeat-containing domain superfamily	Q93YQ1	Q9LV27	1	NA	NA	NA	NA	NA	NA	NA	NA	NA	NA
Q95748	1.5388790611200065	0.0843006193501301	11.707694842625592	18.254659016542934	5.806786576994271e-10	7.115417464998056e-9	At_XVE_RAPTOR_suc_24h_TiO	At_XVE_LST8_suc_24h_TiO	R1067	NA	NA	NA	NA	NA	NA	NA	Q93YQ1	Q9LV27	1	NA	NA	NA	NA	NA	NA	NA	NA	NA	NA
Q9FR53	2.000541676754497	0.09011481379738136	12.494242879608809	22.19992021791905	2.0478522520604717e-11	5.127632323374247e-10	At_XVE_RAPTOR_suc_24h_TiO	At_XVE_LST8_suc_24h_TiO	R1067	AT1G50030	F2J10.19;<br>F2J10_19;<br>target of rapamycin	cytoplasm; nucleus; polysome; protein-containing complex	abscisic acid biosynthetic process; auxin-activated signaling pathway; brassinosteroid mediated signaling pathway; defense response; dephosphorylation; embryo development ending in seed dormancy; gravitropism; negative regulation of autophagy; negative regulation of defense response to virus; phosphatidylinositol-3-phosphate biosynthetic process; phosphorylation; positive regulation of abscisic acid biosynthetic process; positive regulation of auxin mediated signaling pathway; positive regulation of brassinosteroid mediated signaling pathway; positive regulation of cell growth; positive regulation of DNA-templated transcription; positive regulation of embryonic development; positive regulation of glucose mediated signaling pathway; positive regulation of rRNA processing; post-embryonic development; response to auxin; response to rapamycin; response to stimulus; response to virus; rRNA transcription; sucrose mediated signaling	1-phosphatidylinositol-3-kinase activity; ATP binding; identical protein binding; kinase activity; nucleotide binding; protein binding; protein kinase activity; protein self-association; protein serine kinase activity; protein serine/threonine kinase activity; protein-containing complex binding; transcription cis-regulatory region binding; transferase activity	target of rapamycin [Source:NCBI gene (formerly Entrezgene);Acc:841427]	Phosphatidylinositol 3-/4-kinase, catalytic domain; PIK-related kinase, FAT; FATC domain; FKBP12-rapamycin binding domain; Protein kinase-like domain superfamily; Armadillo-like helical; Tetratricopeptide-like helical domain superfamily; PIK-related kinase; Armadillo-type fold; Phosphatidylinositol 3/4-kinase, conserved site; Domain of unknown function DUF3385,  target of rapamycin protein; Serine/threonine-protein kinase TOR, catalytic domain; FKBP12-rapamycin binding domain superfamily; Phosphatidylinositol 3-/4-kinase, catalytic domain superfamily	Q93YQ1	Q9LV27	1	NA	NA	NA	NA	NA	NA	NA	NA	NA	NA
